,User,Date,Score,Review
845,herrmoekl,"Aug 23, 2021",4,"I am a huge fan of Bloodborne and call it one of my favorite games of all time. Bloodborne was my introduction to From Software. After playing BB i played DS3 and then Sekiro. While Bloodborne was and forever will be my favorite of them i had a lot of appreciation for DS3 and Sekiro. Things i love about Bloodborne is it´s smart level Design, it´s extremely challenging but rewarding Gameplay and it´s horrifying beauty. All these 3 things are lacking in this Game. I probably am part of a minority with thinking that this Game didn´t age well. In my opinion there is two types of difficult Games: a good one and a bad one. While i would classify BB, DS3 and Sekiro entirely as the former here it´s too much of the latter. Tight hallways that take your view while having extremely aggressive enemies in the way not being able to really see yourself or them well. Unbalanced Boss fights put in weird spaces that don´t seem nearly as thought out as later entries in From Softwares catalogue. Then there is the Level Design. This is where Bloodborne shines and delivers again and again with it´s clever and rewarding distribution of Lamps (checkpoints), something almost entirely missing from this Game. Whereas in Bloodborne and Post-BB Games i felt rewarded after fighting through a tough area arriving at a checkpoint or discovering a new area here i never have those experiences. There is no feeling of joy after finishing a Boss after studying their attack patterns because most Bosses lack ambitious mechanics. Moreover the Mechanics of Bosses don´t really feel integrated into the Gameplay. Again, with all the Post-BB Souls Games there was a coherence between the Boss Design and Gameplay mechanics. Whenever i died in those Games to a Boss or enemies i always felt like i wasn´t good enough, thinking about the enemy attack patterns and how i could improve. When i die here i find myself most of the time thinking about poor design choices such as the things mentioned. Another example of it´s unbalanced mechanics is farming for healing items. While BB did have the need to find healing items as well the distribution was way more balanced out and enemies would frequently drop them. In certain areas of Demons Souls you wont find any healing items at all which adds to the overall feeling of frustration this Game leaves me with."
846,MickeyBrownEyes,"Feb 12, 2021",10,"Exquisite game, it masterfully preserves all the magic from the original and brings it to the next gen. What a lot of good memories, all remade and recrafted to bring us an unforgettable adventure again!"
847,devchaos,"Jun 24, 2021",10,"Love this game, but not excellent performance. 60 for with not good graphics. 30 for my grandfather only. Fe"
848,johanBjorn,"Dec  2, 2020",7,"It's pretty, but you can feel its age as you play it. It's obvious that this was the first iteration in a really great franchise, because the core mechanics of the game feel much less polished. It's not a bad game by any means, it's just not particularly fun to me. It feels more like a grind than a joy to play."
849,ahmadhz1999,"Aug 22, 2021",8,"This is one of the best looking games that I have ever seen and you have the option to pick 60fps which is great. The gameplay is not the best but with the dual sense haptics the combat feels very real and satisfying. The music is not as good as other souls games but is good enough. The worst thing about this game is the enemy AI and this affects the difficulty a lot. Some bosses in the game are basically braindead and that makes it too easy to beat them. If this game is your first souls game then that is not a huge problem because the game might be already hard for you. However if you have played a souls game before, the AI will make the game too easy for you and that is not good. Overall even with the AI problems I highly recommend this game to people that like challenging games or other soul-type games."
850,Nimins,"Sep  7, 2021",10,Legendary game. Beautiful and filled with secrets och hidden paths. Great boss battles and nice level design. Many builds and lots of replayability. People rating this game less than 10/10 need to git gud.
851,Belafonte,"Apr  5, 2021",9,"I have to say that I am equaly amazed by the genius of the original game and by the deepest respect of this remake for the source material. Combats feel so good and the game is so beautiful. However, it is clear that the formula has been refined in the following Souls trilogy. veterants from Souls games might feel that bosses or some levels are a bit videogamey compared to the recent Fromsoftware games."
852,CrossXaberS,"Aug  7, 2021",9,I've already played the original and this faithful remake @ $70 is worth it for the fans of the franchise. This is not just a simple graphic upgrade. There are numerous change and tweak that actually improve the playing experience.PROS:- Load time is almost nonexistence. It really help get you right back in the game after a frustrating death/mistake- More streamlined inventory management where you can instantly send items back to Nexus so you don't have to be upset when you have to leave the loots there on the stage. You can even forge weapon using your materials/stones/ores directly from the Nexus. It's really convenient.- 8 directional rolling. + 100% freedom of movement compared to the original. Can't say no to that!- Performance mode @ 60fps is a game changer for many ppl saying 30fps is unplayable- Best nextgen graphic with the art style of soulborne games. *chef kiss- Freaking photo mode to really appreciate that godlike graphics and add your own unique touch.- New trophies list that is more fair than the original (RNG BS)- Penetrator armor challenge adds some new contents and reasons to push through CONS:- Artistic liberty taken with some character designs actually worse than the original (fat officials)- Miss the opportunity to finally realize the cut content of the 6th Archstone- Some contents locked behind paywall of the deluxe edition and pre-order bonus Overall:9/10
853,XxHunterxX,"May  2, 2021",10,"It has everything I like about Dark Souls games, combat, graphics, music and haptic feedback are 10/10"
854,Kamikazeshocki,"Jun  4, 2021",9,"My last missing Soulsborne game. Awesome graphics, Dark Souls through and through. Though the level design of the latter and Bloodborne is superior and it's a bit shorter. Must have for PS5 owners that can take a hit and any Dark Souls fan."
855,WorldRedbull,"Feb 27, 2021",8,"Demon's Souls is the first actual entry of the souls series, and this is it's remake. How is it? The Good:-The graphics are breathtaking. Easily the best looking game i've played in the past 5 years, it's very easy to get immersed in the levels, and notice tiny details that are really stellar.-The new animations, and haptic feedback serve the game incredibly well. They're easily the most refined in the souls series and with new facial animations it's set a new standard(At least in my opinion) for facial animations in Soulsborne games.-The standard PVE gameplay is amazing, going through each archstone world is a blast, and each area feels distinct and has a unique style to them. Combat itself is really good, it's your standard Souls game, tried and true with magic, dark magic, pyromancies(they're just lumped into magic but it counts), Faith, Strength, Dex. Your typical souls affair.-The story still holds up, it has its great moments like the final boss of the Valley of Defilement, the bridge to the Tower Knight, or many of the NPC's questlines.-A lot of quality of life improvements, World Tendency is easier to figure out, sending items to storage without having to go back to the nexus, reduced loading screens(they're like 5 seconds long at most).-Photo mode is pretty cool.-PVP can be really fun, A lot of weapons can be great in combat, but PVP does have its flaws.-Fractured mode is a fun mirror image of the game and can throw you for a loop if you're not careful. The Bad:-The weapon upgrading system is terrible. Some materials require literal grinding, others are incredibly expensive, and some almost don't show up at all. Getting your weapon maxed out is a pain, and you will want to jump off a cliff.-The PVP can be full of min maxing goons that are the most anti-fun people you will ever meet. There's no magic requirement for spells, so you can meet a level 4 mage that has a high level spell that one shots you, or heaven forbid someone brings the Dragon Bone Smasher early on against you.-Some of the bosses are pretty mediocre or just plain bad. Dragon God is terrible, the adjudicator is still really easy, and the dirty colossus boss is....a thing.-The hitboxes of certain objects or weapons can be incredibly janky. The boulders of Stonefang Valley are a good example. Overall despite these flaws, Demon's Souls Remake is still the classic game from 2009. It was a helluva good time, and is one of my top SoulsBorne games. I prefer Dark Souls 1 honestly myself(Second Favorite), but Demon's Souls  definitely would be third."
856,BoyEx7490et,"May 27, 2021",10,Great remastered remake of Demon's Souls Amazing Action Role Playing Game remade from PS3 to PS5. ^(^_^)^ :)
857,boris_out,"Aug  6, 2021",9,"Лучший эксклюзив PS5 на данный момент! Графика, звуки, проработанность окружения — настоящий некстген"
858,ching00kit,"Aug 29, 2021",10,The remake is ok especially on the graphicsHonestly it is a game of nostalgia back to the time how souls series were started.Highly recommended for those for did not play the original before.
859,lewis1992,"Dec  9, 2020",10,"An amazing, faithful remaster of the original and the BEST Souls game. Best PS5 title by far."
860,KasaethaN,"Mar  1, 2021",10,"This game is just awesome, addictive, beautiful. I absolutely love it. Highly recommend it to anyone."
861,Meh123456,"May  3, 2021",10,"Demon's Souls was a really fun game to play, Bluepoint did an amazing job with this remake the game looks so good and in 60fps it feels great too.I enjoyed all the boss fights, especially flamelurker it felt so good to beat that mf after like 8 attempts...."
862,Bene86,"Feb  1, 2021",10,"Oh my gosh, this is my first Souls game and it's soooo good! I never was bores and i'm in world 4.1 now and its just brilliant. I love the graphics, the sounds, the controll and the rpg system. Its hard but you will learn and learn and in the end, you will kill the boss of a level and this feels so good! Thaks Sony! All this 0-Rating peoples are nostalgic Freaks who hates everything whats not the original or Xbox Fangirls. Or its just to hard for them."
863,Veiled,"Jan 29, 2021",8,El original es un juegazo que me he pasado 5 veces. Este ni idea pero vengo a darle un 8 por algún review bombing que he visto. Sin mas.
864,Marbert1014,"Aug 26, 2021",10,Difficult yet rewarding game. The more demons I slay the more I want to play. Great experience.
865,IIIAHMIII,"Jul 24, 2021",5,Game looks beautifull and the audio is wel done. The rest of the game well im not a fan. The world tenancy system is broken when you play online locking you out of different quests. Also a mob diddint drop the iron key so i couldnt get to an npc. The amount of blue eyes is a joke. Bosses wil 1 hit kill you in new game plus. I like a challenge but to many aspects are broken in this game. parry is incosistent so i cant use that anymore. Lot of backstaps miss. I can go on and on its a decent game but the mechanics are a nightmare. Making this game way harder then it actually is.
866,mklamt,"Aug 22, 2021",0,"Blood borne - AmazingDark souls 3 - Super AmazingDemon souls - meh, no history, i was expecting more from this game"
867,bear00766,"Feb  6, 2021",10,Demon's Souls remake is jaw dropping and more than lives up to the hype. The attention to detail in this game is mind blowing for a launch
868,Agraa,"Jan 27, 2021",9,"O jogo é lindo e segue exatamente o mesmo molde da obra original, para alguns isso é motivo de glória para outros é uma chance desperdiçada de fazer diferente e promover alterações que se fazem necessárias para a época. Arriscaram pouco e trabalharam totalmente na nostalgia, oque não é ruim pois o original é excelente, mas aqui perdem a oportunidade de modernizar um pouco mais o jogo. No geral é um jogo muito competente e quem já conhece a franquia estará muito bem servido, aos novatos tenham calma nessa jornada, sejam persistentes pois Demon's Souls é implacável."
869,kevlarkev,"Apr 30, 2021",8,"An amazing remake. Though it shows in core gameplay and world design that this was the first of the souls series as there are many quality of life changes FromSoft made in the titles after this one. Even so, the game looks,plays and runs beautifully and anyone who enjoyed a soulslike game should find this great."
870,Waskonia,"Jan 10, 2021",10,"Pedazo de remake.El mejor al que haya jugado,súper entretenido y se ve espectacular"
871,xWitcherx,"Jul 12, 2021",10,"No entiendo muy bien el por qué tiene tan poca nota este Demon Soul cuando es un juego de 10, es verdad que en muchas ocasiones lo e odiado pero la satisfacción que te da cuando consigues pasar los Boses es tremenda. Creo que todos alguna vez en nuestra vida tenemos que probar algún juego de este estilo, y creo que este Demon Soul es prefecto para iniciarte en el mundo Soul"
872,SplitMind,"Jul  4, 2021",7,"After DS3 I'd taken a break from Souls games for the sake of my sanity, but having got a PS5 my options for games were very limited and my curiosity got the better of me, so here I am feeling like I've been through the Souls wringer one more time. The graphics of Demon's Souls are actually a mixed bag for me. What you see is very well-crafted, however the biggest drawback is the level design and the dark and dankness of pretty much every level. When you get to more colourful and vibrant environments the game shines, however many levels such as the prison, swamp and tunnel were just so dark and dingy that I feel they really missed an opportunity to show off what the PS5 can do. I think this is a result of staying faithful to the original a bit too much, which is a recurring problem in Demon's Souls. The gameplay of DS has rarely been better than it is here. Anyone having played any DS game will feel at home. The backstabs, rolls and challenging gameplay are here in spades and typical Souls-fashion. For the most part this is excellent and they aren't changing what doesn't need to be changed. Yet there are some baffling design choices that should have changed. The game basically has an extra layer of difficulty that arises from bad design to me. A lack of bonfires means a long journey to get to most bosses if you die. Think Bed of Chaos only not so maddening, There are shortcuts but these aren't at all short at times. The level design leaves much to be desired. You have 4 levels split into roughly 4 sections, however each one is quite one-dimensional and some of the labyrinthian elements are downright frustrating and unbalanced, such as the prison and swamp. This detracted from my enjoyment noticeably and again seems the result of remaking rather than reworking the original. If there was one game mechanic I would have changed it would be health being cut in half when in Phantom form. This is bewildering design choice, making for punishing rather than challenging gameplay. Add to this the unnecessary world tendency mechanic and I was not impressed at having to spend 90% of the game at 50% of health. This is something sequels rectified and the remake should have also. Finally for gameplay, we have the boss fights. I'm actually torn on whether this is a good or bad thing, but most of the bosses resemble puzzles rather than fights. This means no matter how skilled you are you are not going to win unless you figure out the mechanic or look it up online as I had to do a good few times. I think only the Dragon God boss really irks me and anyone who has played the game will know why - it's just bad and banal game design. Having said that, the diversity of bosses is very good and few were outright unbalanced. Lastly, the story. As typical for souls games, the story here is minimal at the surface level but you can delve further into the lore if you like. This is something I've always applauded Souls games for, however at the beginning of Demon's Souls we do get a fairly hefty story introduction and I am happy to see that too. Overall, Demon's Souls is faithful to the original, for the worse in my opinion. However, this is still a pretty good Souls game and it actually makes me appreciate Dark Souls all the more. I am glad Demon's Souls was not my first Souls game as I can really feel the 'prototype' nature of it in comparison to Dark Souls. It's a bit of an indictment on modern gaming that a remake of a PS3 game is the USP of the PS5, but at least it's actually a good game and not riddled with live services and microtansactions."
873,Jaimeastur,"Feb 15, 2021",10,"BUENÍSIMO! Me ha tenido súper atrapado de principio a fin, una obra maestra"
874,Rezoman,"Feb 10, 2021",9,Fantastic remaster! Honestly I was happy to know that a different studio would be working on it since the dark souls remaster was literally just a frame rate boost. People who are saying that the dark atmosphere is gone are just a bunch of babies who are hating on the game cause it still has a dark atmosphere.
875,Christo1,"Aug  3, 2021",10,"It took me some time to truly appreciate the difficulty of this game a d it’s mastery level, but once you do that you see what a true gem Demon’s Souls really is.  This is one hundred percent a masterpiece and I hope they make a new installment in this series on the Ps5 again soon!!!"
876,BrightAbyss,"Dec 30, 2020",9,"Demon's Souls is a great game, but it isn't for everybody. Like all From Software products, the game is challenging. Players could spend many hours on just one boss and that can be very frustrating to some. Despite this, I can promise you that when you do eventually beat the boss, it will be extremely rewarding. If you are more of a casual gamer not looking for a challenge, then this may be a game to pass on. If you are a competitive gamer who has never played the original, then you will absolutely love this game. Now if you have played the original or are a From Software game veteran, the gameplay is almost identical to the original. This means that yes the AI isn't the smartest, your character doesn't move like a more modern game, and places to reset the world are much farther apart. This is the main reason why there are a few people that gave this game a low score on this site. The company stayed true to the original game, only making it look and run better, and that's all I wanted in it. That's why I enjoyed it so much, but some people will disagree. At the end of the day, it's a great game that I would recommend to anyone looking for a challenging, gorgeous, and satisfying PS5 game."
877,parsatommyy,"Nov 14, 2020",10,Incredible game bluepoint is master of remake. Demon souls it's a next gen game
878,Bakoluk,"Aug 31, 2021",9,Graphics 10/10Playability 9/10Entertainment 9/10DualSense: 7/10Overall 9/10
879,Khnemu,"Feb  4, 2021",10,"Remake 1:1 perfeitinho com gráfico lindo demais e otimizações. Combate delicioso, desafiador e viciante, com aquela atmosfera souls espetacular."
880,Ddaygiugno1944,"Jun 12, 2021",10,"merita il voto top essendo una esclusiva ps come è per il 97% delle esclusive ps, spero che bluepint  venga acquisita da sony e quindi entri a far parte della stupenda famiglia dei playstation studio"
881,fabiola1,"Jun 13, 2021",8,"sin duda el mejor juego de ps5 a la fecha, lo termine hace pocas semanas y me ha durado bastante, en gran parte porque no soy tan habil pero cada vez que avanzama me sentia tan satisfecha. yo pienso que los modos de dificultad en estos juegos no van, lo mejor es jugarlos con la dificultad a la que fueron diseñados. los graficos son totalmente impresionantes!"
882,Gyns23,"Dec 27, 2020",9,Best PS5 starting game up to date. It shows the power of the next-gen console.
883,Krachsus,"Feb 16, 2021",9,Amazing game.. Mindblowing graphics and boss fights. Just one contra.. It aint that hard souls game.
884,Cosca,"Jan 21, 2021",10,"A very good remake, which honors the original, while adding a few little improvements and cool secrets here and there."
885,Przemun1304,"Dec 26, 2020",9,"Oh my god. I wasn't expected that would be look so amazing.I played on PS3 many years ago, this remake showing a player a totally different feelings.Beautiful and stunning game.BluePoint made it again! Thank you for this remake"
886,iMustang,"Jun  7, 2021",9,"I loved this game much more than I ever thought I would have, in no short part from how beautiful the PS5 remake was to experience with stunning visuals, fantastic music, and a fantastic experience with the dualsense controller. Yes it was brutal, yes I died a lot, but I became inspired to do better with each failure I had which made my victories all the sweeter. Maybe it's because I was conditioned by the initial difficulty and the lack of checkpoints, but I always seemed to feel rewarded when the game would give me something to make things easier or I found a way to get more souls. That feeling of trial and error, risk and reward, and frustration to triumph made the game unique and fun to play, almost like a hard mode for Legend of Zelda. I do wish the story was a little more transparent, and I do still want to watch a deep dive video to the lore to appreciate it more, but I wish it could have been experienced to a higher degree in game. Still, that's a very minor complaint as the story is fairly straightforward to begin with. I always thought these sorts of games could never be for me, but I definitely found something special in Demon's Souls, and I may just have to hunt for the Platinum in this little gem."
887,Daniel0809,"Jan  9, 2021",5,"Only thing that makes these games hard is no check points, thats it. Its not a difficult game but its very time consuming because they make it hard by starting all over when you die. Great graphics though"
888,DoctorCocToPuss,"Dec  3, 2020",7,"I'll start off by saying that I don't believe this game is the system seller it's been propped up by games media to be. It is an extremely faithful remake, all things considered, that's focus is entirely on preserving the feel and gameplay of the original. This was a difficult coin to toss for Bluepoint as you'll discover in the rest of the reviews. Many people are ecstatic that the game remains devoutly faithful, while a smaller minority are angry that the game lacks innovation. In my opinion its served them mostly well. The idea of a ""remake"", to me, is to provide a modern facelift to an older game while remaining true to what made the game so beloved mechanically and narratively when it was first introduced. Bluepoint has done just that to near perfection as far as I'm concerned. Combat and exploration are unchanged. That said, I'm not sure that the original Demon's Souls was ever that ""perfect of a game to begin with. It was From Software's first foray into this style of game and, as a result, it lacks the quality of life improvements of their more modern games. For example, checkpoints (archstones in Demon's Souls, bonfires in Dark Souls) are EXTREMELY sparse. Leading to unnecessary repetition of entire stages should a boss best you. Granted, this isn't a huge concern as many of the bosses are mechanically very simple and/or very easily defeated once you've discovered their ""gimmick."" In comparison to the bosses of later FS games, these fights are laughably simple, but still offer a good challenge to a beginner going into the game blind. Art direction, stage design, and build flexibility was and still is a highlight. Story is out there to be discovered but is not handed over. You must seek out the answers to your questions via the environment or NPC's. This helps to further immerse you into the position of the player character in my personal opinion. Unfortunately, this also means you can miss a large chunk of the narrative should you decide to ignore NPC's outside of what they have to sell you. Overall, I'd highly recommend this game to someone who's never played any From Software ""Souls"" style game before. I believe it's the best game to be introduced to this style of game, due to it being ""relatively"" easier than the other titles. If you've played the likes of Bloodbourne, Dark Souls 3, or Sekiro, this will seem like a mechanical step backwards. If you're a die-hard fan of the original i'd be surprised to find you dislike the remake."
889,Stoys,"Feb  3, 2021",8,"The game looks soo good. and it plays really well.even though blueprint has  done an over the top job making this game feel like a new game,there are still some old mechanics that makes me dislike the game.like the  ""punishment"" for helping others in a world.there is no replay value other then the trophies and platinum.and the pvp is broken IMO. hit boxes and stuff is soo wierd.But i overall loved the game.and i would recommend it too every ps5 owner as this is a really good ekslusive game!i wish future soulsborne games are gonna look like this or hopefully better!"
