,User,Date,Score,Review
0,Elite_Reviews,"Nov 22, 2020",2,"Like so many others have already stated, this remake doesn't live up to original, not even close. They took great Japanese game and had no idea what to do with it. Conclusion : They made boring boss simulator. I had to buy it to try it, but i can say that after playing it i wouldn't even buy it for 30 dollars, just giving honest advice! Specially in rough year like 2020, when many don't have lots of money, it's wise to think what to buy and i wouldn't recommend this one. It gets boring quickly and add almost nothing to original. I would advise buying something that is actually fun and has lots of content like Assassin' Creed Valhalla or Cyberpunk 2077!"
1,SorrownoMore,"Nov 22, 2020",2,"Strong doubt that any real souls fan will like this, personally i feel empty after playing this.Nothing stood out, yeah some bosses were okay, but overall it's just meh. I would give it way higher score if it was like 30 dollars, but 70 is just too much for this. Overall i didn't like it.I don't regret buying PS5, because i have so many other games to play, but i regret buying this game."
2,dreamof-,"Nov 22, 2020",1,I didn't enjoy Demon's Souls Remake at all. Something felt off with it. Almost like there was no passion behind this project. Some boss re-designs looked worse than original and overall it didn't do enough new things to justify this remake. PS: I have played original multiple times.
3,Bloodborne233,"Nov 22, 2020",1,"Hopeless attempt to remake something that never needed a remake. Any other game would have been better choice, specially something older, pre 2007. I actually got really sad while playing it, because i was really hoping that it's something special, but it wasn't, it really wasn't. 60fps made everything smoother and that's about it. Not recommending."
4,imjusthonest,"Nov 22, 2020",1,"Where this deep, almost scary atmosphere from the first game? If you gonna remake a classic, you have to either make it better or at least same level. This on looks way too clean. I could mistake it for any indie game honestly. 70 dollars for 60fps. Welcome to 2020."
5,XfighterX,"Nov 22, 2020",1,"I'll be completely honest, i'm not impressed. As a longtime souls fan i was actually confused why even remake it? Original is perfectly fine, but i was like ""fine, i will try it"". Even tho it's 60fps, it doesn't feel ""extremely smooth"". It just doesn't add enough to justify this remake compared to other high quality remakes."
6,Ddraig,"Nov 21, 2020",0,Not worth £70...Only buy this game if you are a hardcore souls fan otherwise you will be hugely disappointed. There’s much better launch titles to get on the ps5 such as spiderman.
7,Powerless,"Nov 22, 2020",1,"Unusually bad remake from Sony. I was expecting something revolutionary for PS5 launch game, because this was supposed to be reason to buy PS5 in 2020, even tho i bought it anyway but for other games. But Demon's Souls remake was just waste of money imo, i haven't even finished it and i probably wont. I literally booted up my PS3 to try original again to make sure i wasn't wrong and no i wasn't. Original actually stood out in 2010. This one doesn't stand out even if really tries."
8,lastofreviews,"Nov 22, 2020",2,"Not what i expected! I was ready for some masterful remake, but what i got was average game. Hopefully Resident Evil 4 remake will be good!"
9,Xandl7,"Nov 16, 2020",0,overhyped game for ps5not worth the pricevery overpricedwait for a saleit doesn't worth it
10,SoundoftheSun,"Nov 22, 2020",3,"I'll make this review really short, because i don't have much to say about this one. Graphics - 8 / 10Story - 1 / 10Gameplay - 6 / 10New boss designs VS The Original - 4 / 10Innovations that would justify this remake - 2 / 10Conclusion: 3 / 10"
11,chuydavid,"Nov 23, 2020",0,"It doesn't worth what I spent on it. $80 Euros, no thanks! It's not that good."
12,justishar,"Nov 16, 2020",4,"I'm someone who played and loved DS3 and Bloodborne and was excited to give Demon's Souls a try, never having played it before. It turns out that this game is extremely faithful to the original game, which means that the mechanics of the game are quite dated. I've put about ten hours into it at this point and I don't think I'm going to go any further, because it's just so tedious. The game is pretty easy for the most part, including the regular enemies and bosses. This, unfortunately, leaves the challenging parts to be the things which aren't fun at all, including the maze like levels and distance between the save points and the end of the level.  If you make a mistake, or if the game throws in something like an invisible enemy that inflicts a new status effect that kills you in seconds towards the end of the level, then you get to retrace quite a long trail to get back where you were. Maybe ten years ago, this would have been less of a tough pill to swallow, but in today's day and age, and after having played (and mastered) DS3 and Bloodborne, this type of gameplay just feels tedious to be moreso than fun. I guess I'm back to waiting for Elden Ring."
13,Sundowner1,"Nov 20, 2020",4,"Caught up in the hype train I purchased this one, but I've never played a ""souls"" games before. After spending a few hours on this one I'd say its a hard pass. The difficulty isnt that bad, much like old generation games like Ninja Gaiden or Castlevania. You just need to learn how to play and what the patterns are. Honestly its not fun though, like at all. Generic character, no story, PVP is ridiculously frustrating while learning the game, and its just boring dying over and over on stupid stuff. Save your money for a sale if you must, but this is the most overrated game I've seen in a long time. It is a glorified tech demo, absolutely beautiful but not worth the time."
14,fight387,"Nov 13, 2020",1,Resident Evil 2 team actually tried when making remake of classic. This one just feels soulless cash crab. Wouldn't recommend to anyone.
15,firefades,"Nov 13, 2020",3,"Overall very ""whatever"" remake. Ironically it feels like there's absolutely no SOUL in this game that's supposed to be part of SOULS SERIES. I would say wait for sale, but i would rather more recommend original."
16,lifeline_,"Nov 13, 2020",0,"Only strength over original is 60fps, that's it. Would never recommend this to anyone."
17,fly78,"Nov 13, 2020",2,"In my honest opinion it's not worth it. There's so many other games that actually need remake. This one is perfectly playable on ps3. PS5 starts out super weak, spiderman dlc and remake of not that old game? Come on. I have killed two bosses so far and it's just same. I have original as well and i rather play that."
18,enter77,"Nov 13, 2020",1,Weak remake with awful fake marketing. Disgusting. I would absolutely never recommend this game to anyone.
19,drksoulsforever,"Nov 13, 2020",1,"I'm so done with these endless remakes already, but the way they are marketing this is just awful. They took classic souls entry and painted it over, added hd textures, 60fps and now that's what console launch titles are going to be?? Not recommending this."
20,Nektarin,"Nov 22, 2020",0,This is not a demon soul.....Blm did their job.Not even close to the original.0/10
21,actualspiderman,"Nov 13, 2020",2,"Extremely weak entry into souls franchise. Other than graphics and fps boost, it has nothing special to offer."
22,geez99,"Nov 13, 2020",2,"I would recommend original so much more than this ""remake"". They took absolute classic and are trying to make quick cash with it. I still have original on ps3, you can get it cheap anywhere. This weak excuse for a remake shouldn't be a reason to get ps5. I'm very disappointed."
23,riddlemethis445,"Nov 13, 2020",0,This game is not worth it. It's buggy and it pales compared to superior original.
24,fightwithsword,"Nov 13, 2020",2,This must be most overhyped remake of all time. I bet people hype it up because it's console exclusive. I played it 2 hours and i'm already bored. 
25,SandraBenedrin,"Nov 14, 2020",0,There’s no reason for this remake to exist. The PS3 game runs better on PC as it is without the needless redesigns that ruin the atmosphere.
26,strongblood,"Nov 17, 2020",1,"The best thing of Demon's Souls were it's design and artstyle and Bluepoint has successfully ruined it, by editing characters, colors and architecture. On the other hand the bad thing about Demon's Souls were it's unbalanced gameplay and mechanics (you still need to grind items and can abuse some weapons in pvp) and Bluepoint didn't even touched it. Bad, very bad."
27,firsthere,"Nov 13, 2020",1,"Worst boss simulator of 2020. Can't believe people pay 60 dollars to die 100 times on one boss, just to move on to next boss and then next, over and over again. Sekiro at least tried to add some story. This is just meh."
28,Wickilini,"Nov 20, 2020",0,"It comes to a point that a challenge is turned into nosense, there is no fun in this loop."
29,AkiseKun12,"Nov 18, 2020",1,"Fun but with mechanics from a game from years ago, the graphics do not save it"
30,blyumazeiko,"Nov 19, 2020",0,"Если отбросить что она тормозит на ps5, неудобная работа камеры изза которой можно провалиться в яму и умереть так как узкие пространства с ужасным обзором, то что после каждой смерти надо начинать с самого начала, то игра довольно неплохая, но все вышеперечисленное в игре присутствует так что я жалею потраченных денег за это жалкое подобие игры"
31,Jhon71937,"Nov 22, 2020",1,É a mesma coisa no ps3 e ainda custa 300 reais mais 5 mil do ps5 não vale a pena
32,ando3000,"Nov 13, 2020",0,£70 is a total rip off. Greedy Sony trying to rob their early adopters. Rubbish. Don't waste your money.
33,Branvalis,"Nov 14, 2020",4,"Bluepoint reworked its core art, which was perfect as it was, leaving the part that really needed some next gen upgrades same as it was on PS3. As a result, you get nice graphics sacrificing the original eeriee and mystical soundtrack and atmosphere for a bunch of nice 4k screenshots with bombastic music but 11 years old gameplay. Play has no limits? More like marketing has no limits."
34,princessfurios,"Nov 15, 2020",3,"80€.Именно столько они просят за ремейк игры. 80, черт подери, евро.Давайте разберем по полочкам все, почему эта игра - ни стоит таких денег и уж тем более не стоит зваться наследником оригинала. Здесь, по классике нового ориентирования рынка Sony на запад, завезли BLM и SJW-мусор и прочие вещи, которым ним место ни в одной игре. Сеты персонажей выглядят прямиком как треш-фрики из Тамблера. Дизайн игры в целом и персонажей в частности был изменен на западный манер, потеряв былую оригинальность и самобытность. Персонажей сделали более ""репрезентативными"", как модно нынче говорить. И вы понимаете, о чем я сейчас. Про то, что герой априори небинарен и вместо пол здесь есть выбор между ""типом тела А"" и ""типом тела Б"", я думаю не стоит и заикаться.Обещания и реальность. Все мы не должны забывать громкие слова о трассировке лучей в игре на презентации PS5. А что в итоге? Это был обман, лишь ради громкого маркетингового словца. Про то что игра выйдет на PC и ""других платформах"" мы тоже помним прекрасно. Но ведь тогда не вышло бы просить за эту поделку 80€, верно, Sony? Конечно же, верно.Игра спокойно бы запустилась и на PS4, лишь с добавлением загрузок и в качестве ниже. Все мы видели The Last of Us Part II и то, что она прекрасно работала на прошлом поколении. И вы хотите сказать, что ремейк Demons Souls бы не пошел? Не смешите свою же аудиторию.Это глупость и жадность. Вопиющая. Ценник этой игре должен быть 40$, как у ремейка первой части Mafia. Не больше. А за 80€ и спрашивать с игры нужно, как с того, что стоит 80€. И это не цена данной ""поделки"". Ни в коем разе.Но, судя по оценкам, люди съели и это. И попросят еще. Тогда, впрочем, не жалуйтесь позже на то, какие сюрпризы вам приготовит Бобби Котик, поняв, как легко доить из такого стада как вы, ставящего 10/10 подобной ""игре"", деньги.Пожалуй, тут больше нечего сказать."
35,AceAscendus,"Nov 13, 2020",0,"Bluepoint completely destroyed the Soundtrack, Art Direction, Sound Design, Atmosphere and Environmental Story telling of Demon's Souls. Anyone who played the original Demon's Souls, but also likes this abomination is not a true fan of Hidetaka Miyazaki, From Software and the Soulsborne games. Only people who didn't experience the original Demon's Souls can like this garbage remake, because they don't understand what they are missing and what true Demon's Souls is."
36,snakemuho,"Nov 13, 2020",3,"To my knowledge, the appropriate term for something like this is ""Reforged"", not ""Remake""."
37,DigitalDevilSam,"Nov 14, 2020",1,"Completely ruins the aesthetic and the atmosphere and the soundtrack of the original game, which is the very thing that made the original a timeless classic. It reminds me of the WarCraft3 remake; a cheap cninese knock-off (no offence to the chinese)"
38,Buhan,"Nov 14, 2020",3,"Game play is decent however the artistic changes made this remake too difficult to truly enjoy, especially coming from someone who considered the original a favorite."
39,devilofumes,"Nov 13, 2020",4,"Disgraceful remake. FromSoft's art direction is lost here thanks to western developers thinking they know better. The environments, the lighting, the NPCs, the bosses and enemies, the voice acting, the sound design, and the soundtrack all have very drastic and awful changes to them. Don't get this if you're a fan of the Souls games."
40,tec,"Nov 14, 2020",0,"Game is more barebones than any other Souls game but suddenly after america retextures it, giving it only a visual upgrade, it is fantastic? no this game is a scam, demons souls was 9 years old with a 2 gen difference. it´s a glorified texture pack for 70 bucks + online tip, nothing new is added, no QoL changes. the visuals were just fine and releasing this as a consoleseller/ main lineup title is simply embarrasing. it was a dark gothic setting with little fantasy elements. now it´s bright and shiny. it´s wow reforged all over again, unfortunatly it´s released as a ""exclusive"" on a new hardware so people need to justify throwing their cash away for a new machine which tries even more to seperate you from your belonings and making you dependable from sony. big nope."
41,unotavailable,"Nov 29, 2020",0,"This is the laziest remake I've ever seen. There's been almost no changes at all. The only thing I noticed is the ability to send things to stash. Otherwise they just took the old game, put almost no work in it, slapped a $70 price tag and called it a day."
42,Hij45g,"Nov 13, 2020",0,This game lost its true style. A video game which was an good old game has lost its charm. It's difficulty system has been tarnished. I am really dissapointed
43,neoneekeri,"Nov 14, 2020",0,"This is an absolute travesty, I see no reason to give it anything above a zero when its quite literally the exact same game I already own but with an ""americanized"" artstyle. Bluepoint ""remade"" a great artists masterpiece by turning it into a disney animatronic ride where you need to be at least 110cm tall to enter. Its an absolute abomination and I cant decide whether to cry or laugh while comparing it to the original. A great testament to just how little SONY cares about games and how they only see them as products to milk for the lowest common denominator."
44,sleshdot,"Nov 16, 2020",1,"While the graphics is indeed awesome, the most iconic aspect of this game was its soundtrack. They ""remastered"" wrongly, removing all the iconic bits that made it so special, and now it sounds extremely generic fantasy music. The soundtrack of the Tower Knight boss fight? Gone. That's really a shame."
45,Emadddd,"Nov 13, 2020",0,One of worst remastered that I ever experiencedBravely I can say even god fall is much better than this ****
46,gamesssix,"Nov 29, 2020",0,"trash, too bad, you will only like if you are a franchise fan, if you're not, don't buy it!"
47,Lintzzz,"Nov 14, 2020",0,"Ridiculous long ways to go at the boss. Bosses are gods. Dark Souls 1,2,3, are infinite better, and now this refurbished...."
48,CollectRunes,"Nov 30, 2020",1,"Had solid potential, but sadly fell flat on pretty much every aspect. Other than 6ofps (that's like normal for every next gen game by the way, so it shouldn't be selling point anyway) it offer nothing really interesting. They don't do some crazy re-invention that would justify this remake like Final Fantasy VII Remake or Resident Evil 2 Remake. There's a reason why ""Psycho"" (1998) remake is so hated, but ""Dawn of the Dead"" (2004) remake isn't. Literally same thing matters for games as it does for movies."
49,Nostradamous,"Nov 28, 2020",3,"Really low quality,Absolutely Hollow content.Unbelievable priceAnd DissappointingComparabale at mobile games class!"
50,fairpricing,"Nov 30, 2020",0,Videogame publishers don't deserve 70 dollars just because they decided they want it.
51,and94,"Nov 14, 2020",0,"Well, most people prefer Lil Pump over Beethoven, so that explains the 10/10 reviews. Ruined the OST."
52,RoadtoHeaven,"Nov 30, 2020",2,"I'm pretty sure many people actually bought it, because there's not much else to play on PS5 right now (that's sad btw), but i strongly doubt that anyone deeply loves this game. What i'm seeing right now is that everyone is addicted to Assassin's Creed Valhalla and that's not PS5 exclusive. But for some reason everyone is using PS5 to play that, so maybe sony messed up with launch exclusives? I don't like Demon's Souls remake either, it feels boring and uninspired."
53,epicgamer444,"Nov 30, 2020",1,"@ GamingNordMediaNot just ""sources"". That's exactly what happened and i'm sure most people who have brain, already know this. This game got over 500 positive user reviews in first 2 hours. If you click on their profile it's very clear it's fake and some of them forget to translate it to english, so they posted review in their own language. So i did some research and basically it's bunch of asians from different asian countries who possibly get some money for writing positive reviews. So then some negative reviews came out that started calling it out and all of these were deleted. And now they have over 1400 positive reviews lmao. It's crazy."
54,Theboss2317,"Nov 14, 2020",1,"No tiene Ray tracing, no tiene 4k nativos, anda perfectamente los 60 fps y gráficamente no se ve tan como lo esperábamos, es lamentable que se utilizará para abrir una nueva generación, al contrario de la competencia que no tenía nada pero no la kgaron como lo hicimos aquí."
55,GamingNordMedia,"Nov 28, 2020",0,"The game is unplayable and the fact the developers refuse to put an easy mode in the game just makes the audience who actually can finish the game very small. There are sources that have come out and said FromSoftware/Sony paid the media to put a better score on this remaster. DONT TRUST WHAT YOU HEAR! If you like very very very difficult games then this is up your alley if not stay far away and don’t let positive reviews change you mind. This game caters to one audiences, people who love dying 60 times in one area"
56,jpw1978,"Nov 13, 2020",10,One of the best remakes of all time..You wont be dissapointed on this masterpiece..
57,RidiculousDeath,"Nov 15, 2020",0,Never thought I'd see a woke *souls game. This remake is SOULLESS. Sorry for the pun.
58,Torrant,"Nov 24, 2020",0,Probably the worst game i've ever played. Just can't bear it anymore. Demon's souls is now demon's Ruins.
59,doproyee,"Nov 13, 2020",10,blue point showed us how a remake game supposed to be. beautifully developed graphics and nicely made animations are pleasure to original fans.
60,Nezku,"Nov 13, 2020",10,"Great game in every way!  Best remake ever, best start to a new generation, this is how creativity is made"
61,Lolasoxd,"Nov 13, 2020",10,"The game of the best souls of my life! I can highly recommend it to everyone! Huge game! Great for character creation, graphics, visuals, mood. The controller makes the whole game even more amazing! There can be no complaints about either Ps5 or the game! Whoever scores this didn’t even play with it, just intentionally pulling down the game. Unfortunately, there are a lot of trolls. It is better not to deal with them. Maximum point for me."
62,Farhad_jz8,"Nov 13, 2020",10,Great remake.goodjob Bluepoint.its a great game to start next gen with......
63,san1739,"Nov 13, 2020",10,"Such a stunning remake!! Bluepoint games did a great work. The atmosphere is lit, the graphisms are incredible, the game can be at 60fps and the news soundtracks are beautiful.A must play for Soulsborne veterans and for newcomers of course"
64,Mahdiarsenali,"Nov 13, 2020",10,Awesome just awesome. What a remake.don't listen to haters this game is more than great
65,Sunda12xd,"Nov 13, 2020",10,The game is awesome! The plot and gameplay is very interesting and good Bluepoint nailed it
66,felipenavarro92,"Nov 13, 2020",10,"Thanks for that, Sony! This game is just perfect!!!!!!!!!!!!!!!!!!!!!!!!!!!!"
67,xKikiRaptorX,"Nov 13, 2020",10,"The game of the best souls of my life! I can highly recommend it to everyone! Huge game! Great for character creation, graphics, visuals, mood. The controller makes the whole game even more amazing! There can be no complaints about either Ps5 or the game! Whoever scores this didn’t even play with it, just intentionally pulling down the game. Unfortunately, there are a lot of trolls. It is better not to deal with them. Maximum point for me."
68,VieRus8u,"Nov 13, 2020",10,"What is there to say, its a souls game. They took the game that started it all and built it from the ground out and gave it a rocket engine to boot.I love this when it came out on the ps3 and love it even more on the PS5. This game has everything you loved about the older game plus more, the only thing I was disappointed about was the 6th Archstone. Maybe they will get the go ahead to make a DLC where they fix and finally give everyone what they wanted for so long...a whole Archstone and new lands to explore."
69,Xavion,"Nov 13, 2020",9,"I am not sure what else to say other than this game is absolutely beautiful and smooth to play. As a massive souls fan I cannot recommend this game enough, the environments and atmosphere are amazing. The combat feels good and build diversity is high My only knock on the game is item weight, I really feel this one thing is just a bad design, I did not play the original but I saw others voice their displeasure over keeping it as well If you are a fan of the soulsborne series then I highly recommend you give this game a playthrough, with the active online community its going to be a blast"
70,Alixa2s,"Nov 13, 2020",10,Bluepoint has done it again. Another great remake. Great gameplay with smooth frame rates and one of the great visual graphics in video game history. Games like this are the why PlayStation has always been better than Xbox.
71,Coastal2009,"Nov 13, 2020",10,Amazing game. I’m a huge souls fan and this game has not disappointed. Highly recommended.
72,Memo_,"Nov 13, 2020",10,Best remake I ever I can’t believe that a soul game can be that beautiful hard game of the year without second thought thank you bluepoint for this masterpiece
73,Gaara_5,"Nov 13, 2020",10,"Like the original, it is very impressive and soulslike lovers will love it."
74,ZeNx_,"Nov 13, 2020",10,Unbelievable remake. Bluepoint has done a fantastic job. It is the best game visually I have ever played. WHAT A GAME !!!
75,magusar0707,"Nov 13, 2020",10,"Such a stunning remake!! Bluepoint games did a great work. The atmosphere is lit, the graphisms are incredible, the game can be at 60fps and the news soundtracks are beautiful.A must play for Soulsborne veterans and for newcomers of course"
76,Carlosxd80,"Nov 13, 2020",10,"Bluepoint has done a great game this time, gameplay is smooth and locked at 60fps. The plot is incredible and interesting also there are a lots of weapons to use. Everyone needs to play this"
77,JoeAmoudi,"Nov 13, 2020",10,"Bluepoint are the masters of remakes and demon's souls is their best work, the best graphics ever."
