,User,Date,Score,Review
296,doug10_troiano,"Nov 16, 2020",10,"Bluepoint novamente fazendo um excelente trabalho com remake de Demon soul trazendo uma nova experiência na franquia souls melhorando aquilo que já era excelente no game do ps3. Sony novamente começando a geração com pé direito trazendo inovações, gráficos e exclusivos pra seus clientes proporcionando um baita jogaço com mais de 40 horas de campanha e com verdadeiros gráficos de próxima geração, merecidos 10/10"
297,elrubenxD,"Nov 16, 2020",10,The game maintains the essence of the original game and the controls and difficulty feel quite good. This game is super good
298,Castro02,"Nov 16, 2020",8,"Jogo sensacional gráficos totalmente criado do zero, jogabilidade não mudou nada."
299,Avorax,"Nov 17, 2020",10,"Dont trust review bombres, either you are a veteran of the souls saga or a newcomer THIS game just ROCKS!!!IT is one of the best games of the saga and is rebuild  like a new masterpiece!"
300,LegendxGamer,"Nov 14, 2020",10,"10/10! PS5 is The best way to play a souls game. I really hope Bluepoint takes over Bloodborne 2 development. Now I understand the price point. Demon’s Soul Remake is amazing!! Everything is faithful to the original, but they made it even better!! Animations, textures, lights, mechanics, music etc!"
301,Logan_L1V3S,"Nov 15, 2020",9,"Incredible remake! I’m having such a good time with this game, it’s absolutely stunning and combat is much more fluid than meets the eye. I see a lot of user reviews stating they ruined the original and absolutely baffled that this game is getting anything less than a 6 by these hardcore originalists, it makes no sense for a game that has kept 98% of things intact. The only changes are the significant aesthetics and quality of life improvements. It’s no where of a deviation to the original, but to each it’s own. This is a must buy for sure (if you’re into punishing games!) The only thing stopping me from giving it a 10 is the HUD, wish it was modernized as it clashes a bit with everything else."
302,ELDUROXD,"Nov 15, 2020",10,"El de Ps3 me encantó, no os imaginais lo mucho que estoy disfrutando esta joyita ❤ 10/10Los gráficos El estilo de juegoLos tiempos de carga. Todo es perfecto"
303,GralClaudio,"Nov 15, 2020",10,"Masterpiece. The game runs absolutely smooth, the graphics are true next gen, and the gameplay is fluid and constant. I was not going to purchase it but I was positively surprised by the well made mechanics, gorgeous illumination and effects and the efforts on make this game a worthy remake. Perfect launch title, totally recommended!"
304,ThiccTunaSanny,"Nov 15, 2020",10,A truly unmissable unforgettable PlayStation 5 launch title. Do yourself a favor and play it.
305,BetaMoi98,"Nov 15, 2020",10,"BluePoint did an amazing job with this remake they kept the essence of the original and even improved it,  this is how begins a new generation of consoles, with games, and if they are that spectacular the better."
306,NYCITY,"Dec  1, 2020",1,Some people actually think this is good? Bloodborne is my favorite game of all time and i sold Demon's Souls after finishing it. How can anyone even recommend this? I'm so confused.
307,Exlee3000,"Nov 14, 2020",10,"To all the xbots giving this game a zero or a 2 or 3, I say to you , get a life.  For real.  I'm sorry your company doesn't give a crap about making any good games for you at launch.  The care and love that went into this remake us astonishing.  And yes it's a remake because they remade every single asset from the previous game.  This is the game that started it all and I love how bold and quirky this game is!  No hand holding here.  And the art direction and music is out if this world.  Never has a game given a feeling of such accomplishment.  When you finally beat a troublesome demanding boss you know you earned it.  And it will almost always be accompanied by a loud hell yeah.  The game is an all time classic.  Just know what you're getting into.  This game demonstrates the old adage, you can accomplish anything when you put your mind to it!"
308,Rasjam,"Nov 14, 2020",10,"A very faithful remake to the beloved classic. New animations, music, sounds, graphics etc"
309,patrickres9,"Nov 14, 2020",10,"What a masterpiece. Bluepoint did a stellar job maintaining the integrity of the original game, while sharpening it's visuals. This is the launchpoint for the ""Souls"" genre. The atmosphere, difficulty, combat, and lore are incredible."
310,Qouaxlrose,"Nov 16, 2020",10,"Jogo muito bem feito...uma obra de arte, realmente abre a nova geração...gráficos impecáveis...vale cada centavo..."
311,tonyX6,"Nov 14, 2020",10,great game very impressive graphics and sounds This one of the best launch titles
312,Igor9833,"Nov 16, 2020",10,"Jogabilidade otima, efeitos incríveis, graficos sensacionais e uma trilha sonora incrível"
313,Parsaba,"Nov 16, 2020",10,Bluepoint and another great remake.The visual effects of this game is fantastic.The game itself is so difficult but that's fromsoftware fashion.I like to see more from bluepoint
314,Rzayev,"Nov 16, 2020",10,Daymın sovuls hayatımda gördüğüm en iyi oyun 5 aşağı verenler popoonuz yetmedi dimi oynmaya o yüzden verdiniz demon is a best bos yapmayın dark souls oynamayın
315,ALIreza57,"Nov 16, 2020",10,Goooooooooooooooooooooooooooooooooooooooooooooooooooooooooooooooooooooooooooooooooooooood
316,wavetoyou,"Nov 15, 2020",10,A masterpiece. This is how all new gen remakes should be. Absolutely fantastic updates/improvements.
317,LucaCritics,"Nov 15, 2020",10,Demon's Souls Review: 10/10Blue Point didn't just made the original Demon's Souls a hundred times better but they made a must play experience that showcases the power and potential of the PS5.
318,TheDarkness03,"Nov 13, 2020",10,Very good remake! Blue point proves themselves once again to be the masters of remakes!
319,BrunoBucciarati,"Nov 13, 2020",10,"Bluepoint just prove that they’re the best studio for remakes give them any game and they will do it justice, not just demon souls feels fresh but they manage to keep it authentic like the original one but make it feel different in the same way. Not only the graphics are awesome but many upgrades and life fixes are made that make it unique I love this game. As a souls fan having platinum every fromsoft game this is a remake clearly made by a studio who is a fan of the franchise and made it for the fans. Best launch title ever."
320,Alten,"Nov 16, 2020",10,What a game! The graphic is impeccable and the gameplay is very much respectful to the original if not elevates it
321,Aresanderu,"Nov 13, 2020",10,The best remake of 2020. Cool empathic game with solid truth. Excellent PS5 starting.
322,Frazilio24,"Nov 13, 2020",10,"Its the perfect game of a new generation, xbox will never have game like this, only on playstation we will be able to play a game with this quality"
323,zzion,"Nov 16, 2020",10,"What an unbelievable remake. Original game-play and atmosphere but next gen graphics, sound and feedback. So much diligence to feel here."
324,Jonas-san,"Nov 14, 2020",10,"Un jeu sublime, tant par son visuel que par son ambiance et son gameplay. Bluepoint frappe fort et devient maintenant un studio incontournable dans le milieu du jeux vidéo."
325,TheAdmiralKnows,"Nov 16, 2020",10,"Played every Souls game except for this one, until now. Miyazaki is a god, and Bluepoint rules. MUST BUY if you love Souls!!"
326,MarkL123,"Nov 16, 2020",10,"Just want to say, this launch title is absolutely amazing! The atmosphere, the voice acting, the world I have never played before, going into this souls game for the first time has me frantically hoping to play even more than I should. So far, I’ve come to the point where I’m at the prison and I can’t even describe the feeling I get discovering the unknown, reading the silly notes people leave around the world. I can’t stress this enough guys, first, get your hands on a ps5 lol, then... GET THIS GAME"
327,NinnjaCone,"Nov 15, 2020",10,"Um dos melhores remakes disparados já feito, a Bluepoint conseguiu pegar o conceito do game original, e aprimora-lo de sua maneira, sejam em uma soudtrack totalmente reformulada, gráfico refeito do zero e upgrades em relação até a própria gameplay ( como a camêra zoada do original...)E ainda por cima ele colocaram diversas opçãos que trazem os aspectos artisticos do game original, seja os filtros e ost. ( caso na edição deluxe)Concerteza para quem vai se aventurar pela primeira vez em Demon Souls, eu recomendo muito a compra , e até mesmo para quem apenas quer se relembrar mais uma vez do game de 2009."
328,Tomipp,"Nov 14, 2020",10,"Perfecto remake, se merece todos los halagos, posiblemente el mejor remake de la historia ."
329,Carioca33,"Nov 16, 2020",10,"Work of art when it comes to video games, difficult, beautiful and rewarding.The user review will have two bases of haters, people who don't have PS5 and people that can't ""GIT GUD"" just read the red reviews and you know what I mean."
330,resh_aykut,"Nov 14, 2020",10,"Im so glad Bluepoint Games brought this masterpiece back. Demon's Souls has a unique placeto me. I enjoyed every single moment while i was playing on ps3, but this is beyond greatness. I hope their next project is Soul Sacrifice !"
331,MagiCPSG,"Nov 13, 2020",10,"Amazing game, like any Souls the game design is perfect, and the gameplay demanding, but for the first time a Souls comes with high level graphics, a lesson for From Software, hope Elden Ring won't be less beautiful!"
332,Frankdnb,"Nov 13, 2020",10,"Amazing remake, it’s a slow game but that’s how it’s suppose to be. Difficult but rewarding all at the same time, give yourself to play this amazing game."
333,Ytrerio,"Nov 13, 2020",10,"The SoulsBorne genre birther gets a long overdue remake, it’s a must play for old and new fans."
334,anil1632,"Nov 14, 2020",10,Game of The Year.........................................................................................................................................................................................................................................................................................................................................................................................................................................................
335,Onii-Chan,"Nov 15, 2020",10,"Borderline perfection. The only thing I could nitpick would be that the HUD and UI of the game could be designed a bit nicer, other than that it's perfect, a must play!"
336,alexsno,"Nov 13, 2020",10,"really good. exactly the reason i bought a ps5. graphics, gameplay and sound are all great"
337,RonnyB,"Nov 16, 2020",10,"I'm a Xbox/PC player, but damn this game convinced me to buy a ps5 and i regret nothing. The most beautyful looking game i've ever seen. Great lightning, awesome enemy design, the soundtrack is just wonderfull recreated, the gameplay is just great fluent with locked 60fps.That's what i call an absolutely great remake and awesome launch title for a new console release.*i'm looking at you Microsoft* *caugh*Definitely worth every penny."
338,Rankshank,"Nov 15, 2020",10,"Best launch title in the history of gaming. It is extremely punishing and difficult beyond every other souls game, but it is well worth the challenge."
339,Vladziunia01,"Nov 14, 2020",10,Очень классная игруля!!!! Молодцы FromSoftware!!!Bravo!!
340,Criptic,"Nov 13, 2020",10,It’s the amazing 2009 game that you remember with much more improvements and extra content.
341,Iceman6957,"Nov 15, 2020",10,Loved the original and this is just a upgrade in every way. Would have been nice to add some new areas for the remake though.
342,Lukr34,"Nov 13, 2020",10,"I’ve never reviews a game here before but after finishing it I felt compelled to. I am personally a big souls fan and have now played all of them, demon souls being the only one I hadn’t played before. This is arguably the best remake out there. Blueprint did a fantastic job bring this game into the next generation. It keeps the soul of a souls game and seems to be true to the original. The combat is solid and fun, the sound design at time is incredible at immersing you I it the game with the 3D audio. Graphics are probably the best I have ever seen. I played in performance more and never got any frame dips, I would recommend not playing this in cinematic mode, I could tell any difference out side of slightly higher resolution. If you like a challenge and are on the fence about getting this game I absolutely recommend it. I now understand why people call blue point the king of the remake."
343,344250524916602,"Nov 14, 2020",10,"As a fan of the Souls saga, I loved this great game, hopefully and bluepoin continues with more games like that."
344,Thefreecritic,"Nov 15, 2020",10,Why did the heaters of this game give a low score to this game ?? This is a great game.
345,decojss38,"Nov 13, 2020",10,"Jogo espetacular. Faz jus a nova geração. Dificuldade na medida certa, sem exageros. GOTY"
346,Zataros,"Nov 14, 2020",10,"Obra maestra, el primer Soul mejorado como nunca soñaste, con gráficos de infarto. Lejos el mejor juego de inicio de generación. Técnicamente es una bestia."
347,GILTELES,"Nov 16, 2020",10,"Demon Souls is a amazing game. I can´t stop play. Certainly the best ""souls like"" of my life! I can recommend it to everyone."
348,SecludedGodMind,"Nov 16, 2020",10,Game is phenomenal. 0's are from tryhard Xtards. Don't worry about them and just pick it up.
349,BetoVip,"Nov 16, 2020",10,"Nostalgia com gráficos impressionantes, mistura mais que perfeita, acabei e já vou começar de novo, não dá para parar de jogar, já era o melhor na sua categoria, agora com gráficos renovados é imbatível."
350,Luiyoking,"Nov 15, 2020",10,The remake is perfect and the game is more awesome than the original version in ps3 if you like souls styles games this game are the father of all souls games i recomended a must buy game
351,Miha88,"Nov 15, 2020",10,"Спасибо за великолепный ремейк этой шедевральной игры! Если честно даже ремейком язык не поворачивается назвать это переиздание. Bluepoint как всегда выпустила высококачественный продукт, за что им и спасибо! Так держать!"
352,DJLegacy23,"Nov 15, 2020",10,"Game looks amazing and plays great! It kept the timing and coding that made the original play so well but added enough new touches to the world to make it feel NEXT GEN. Bluepoint kept what mattered and improved everything else without changing the core of the game. If they could do this to Bloodborne I coucould ""Prepare To Die"" happy!"
353,Chro,"Nov 16, 2020",10,"The best Launch Game so far.Great gameplay, awesome Grafics, high replayability"
354,II-ZeeuS-II,"Nov 16, 2020",10,"an absolute masterpiece, probably the best ever launch game from sony. The SSD, DUALSENSE and 60 FPS are game changers."
355,Kajan,"Nov 15, 2020",10,"Piękna grafika, płynność i ta niesamowita grywalność. Co tu dużo gadać tytuł obowiązkowy na PS5. Ojciec solsów powrócił."
356,Rondinelli,"Nov 13, 2020",10,"The most beautiful souls like game every made, they are games that make me choose the Playstation brand, guarantee of many quality games."
357,arkien,"Nov 13, 2020",10,"This is how we give a second chance to a masterpiece. This is by far the most beautiful game I've ever played, lights and shadows like we've never seen. And the gameplay is not old at all, this is trully modern and people giving this a bad score are not video-games lovers."
358,adamhughes89,"Nov 13, 2020",10,Once again Sony knocks it out the park. Imagine owning another console when you could be getting games like this on the PlayStation! What fools!
359,Gelider,"Nov 15, 2020",10,Me parece un remake increíble y fiel al original. Es totalmente idéntico y con gráficos espectaculares .
360,Thug86,"Nov 14, 2020",10,I Love the Remake. I played the original ten years ago on the PlayStation 3.
361,RaboCop,"Nov 14, 2020",10,"Conserva la esencia del original pero con un aire muy muy renovado en cuanto a graficos y nuevos movimientos y mecanicas. Se siente volver al primer demons souls pero a la vez totalmente distinto, una experiencia increible y un remake mas que a la altura de el padre de los souls"
362,Romain4921,"Nov 14, 2020",10,"This Demon's Souls remake is just woaw...Graphism are just so incredible and the dualsense just make the game more impressive.For 70$ or 80€ (in europe), i really recommand it. If you want to feel the true next gen, you will have it only for 80€ and that's a good point too.In my opinion this game deserve so much game awards price !!!"
363,Nima9248,"Nov 14, 2020",10,Best game.best remake.......................................................................
364,amirkakavand,"Nov 14, 2020",10,behtarine ejazeh nadid hiteraye nob user rate ro kharab konan albate bazam chizi az arzesh bazi nemitoonan kam konan
365,Whiskeyjacked,"Nov 15, 2020",10,The game is brutally brilliant and the graphics are better than anything I've ever seen in my life. I never knew dying could be so addicting! Bravo!
366,Youngmetro,"Nov 13, 2020",10,"This game is just beautiful simple as that, a work of art. Everything from the lore to the enemies to the level design is just crafted perfectly"
367,Amir_shrzd,"Nov 13, 2020",10,dear xbox fans please don't rate this gameeverybody knows this game is awesome how can a game got 92 metacritic but got 0 user score don't do this xbox fans
368,Cjgame,"Nov 14, 2020",10,"Every body said bad,you have know he is a xbox fan and hate the PlayStationSo this game is realy nice and perfectBeacouse you can see the meta"
369,willerkiller,"Nov 13, 2020",10,"This is the must-have launch title that you need to own if you bought a PS5! At the moment, this is the ONLY game on the market that actually feels next-gen."
370,Eventreality,"Nov 13, 2020",10,Blue point have improved themselves already in shadow of the Colossus remake so yes demon's souls is a great remake they improved alot of things i didn't play the original demon's souls so i don't know what they changed but still this game is one of the best game that i ever played Pls: sorry for my bad English
371,Young99,"Nov 13, 2020",10,"dios mío todavía no puedo creer que esto sea real, muchísimas gracias bluepoint games por revivir un gran juego❤❤."
372,HyruleKratos,"Nov 13, 2020",10,"Increíble remake del clásico de ps3 que no tanta gente pudo llegar a probar, una maravilla a todos los niveles. Recomendado a todo el mundo."
373,wladislaf1310,"Nov 13, 2020",10,"Игра великолепная, студия проделала отличную работу и улучшила уже без того отличную игру."
374,Kal_Wardin,"Nov 13, 2020",10,O melhor jogo anti Youtuber/Streamer que existe hahahaha com certeza vale a compra do ps5
375,Shayanshamsi,"Nov 14, 2020",10,An absolute remake of the best souls game thanks to bluepoint and sony for this masterpiece
376,Cacasecaxxx,"Nov 14, 2020",10,"Vale, dejando a parte la de gente retrasada que esta haciendo review bombing, este remake es una obra maestra, es de los mejores remakes que he visto, no diré mucho más por que es el primer souls y es algo que debes experimentar por ti mismo."
377,Wilgame,"Nov 17, 2020",10,Love the game have seen gameplay of the original but never played. Looks amazing plays great
378,DalekGamer,"Nov 16, 2020",5,asking for the basis of an old game that artists have blessed for half a year 80 bucks is crazy but hamsters and fools grab it
379,publicite12,"Nov 16, 2020",10,"Nice, this game is really  immersive..  good game for the true players. chao"
380,Blair1989,"Nov 15, 2020",10,Absolutely gorgeous remake. Massive improvement on the original with solid 60fps and beautiful environments
381,Rodrigo_Roka,"Nov 15, 2020",10,Excelente 
382,Cesrey13,"Nov 15, 2020",10,"BluePoint increíble !! El apartado de la Luz es muy brutal ! Me encanto, la jugabilidad mejoro y el sonido, una gran experiencia"
383,hehexd123,"Nov 15, 2020",10,"Superb game, isn't as challenging as the other souls games but the fresh coat of paint is intriguing to newcomers as well as seasoned players"
384,facu21,"Nov 16, 2020",10,"Es juego visualmente es una belleza y el personaje se siente incluso más ágil, un juego respetado al 100% por Bluepoint y tal vez se puede echar de menos la falta que contenido nuevo, ojalá a futuro añadan la 6 piedra con complicidad de from software, pero igual es un infaltable en la lista de juegos de la consola sony y una excelente oportunidad para toda esa gente que nunca lo pudo disfrutar en ps3. Un remake NECESARIO. Y toda esa gente que tira hate señalando lo que para ellos son ""algunos errores"" y después acompañados de un 0 como nota final por favor, maduren y dejen de actuar como imbéciles"
385,Josuesimons,"Nov 15, 2020",10,"Es Justo como supuse que seria. Me alegra mucho que el hype y la nostalgia no fueran lo único por lo que estoy disfrutando tanto este juego, ya que se siente tan familiar y fresco a la vez. Bravo BluepointGames y Playstation."
386,Beigin,"Nov 15, 2020",10,"Excellent, it has the essence of the PS3 Version that i beat on my PS3, but with sublime new textures and mechanics that make it a nice remake of the classic game. Fully recommended"
387,toddb360,"Nov 14, 2020",10,"fantastic remake still as fun as the original and just as challenging, one of the most impressive looking games and a true showcase for next gen"
388,Cless,"Nov 15, 2020",10,Demon's Souls is a very special game. It's the game that kicked off the Souls style of games. It's very experimental and does not shy away from throwing players off. So many great ideas for its time. And BluePoint did an amazing job and fixed the one issue the old game had; framerate. It runs so fluidly in the performance mode at 60fps.  There are some weird re-designs for sure. But overall it's amazing. One thing that should be noted is the diffculty. While this is a challenging game.. it isn't as hard as some of the later games in the series. It isn't a walk in the park by any stretch of the imagination but it's also not the hardest souls game. Overall it's as amazing as I remember it and better for the most part. Definitely a must play for fans of the souls style games.
389,Madhal,"Nov 15, 2020",10,The best rpg game i had played since bloodborne nice done sony and bluepoint game by this remake
390,jesusgomez,"Nov 14, 2020",10,"es un gran remake, le hace justicia a su nombre , es el juego mas next gen hasta la fecha"
391,TitoFil,"Nov 16, 2020",10,"El mejor remake que he visto hasta hoy en dia. Un verdadero desafio con el padre de los soul que no te puedes perder, con un aspecto técnico impecable y que te dejará con la boca abierta. Aquí empieza la verdadera Next Gen."
392,Miguels4games,"Nov 17, 2020",10,"Simplesmente o jogo que me fez comprar o PS5 , jogo perfeito, de longe é o grafico mais bonito até o momento, espero ver mais jogos como esse no ano que vem"
393,masterpg,"Nov 15, 2020",10,The best souls game and one of the best rpg game blue point did a good job by this remake
394,Kingofmodernwar,"Nov 16, 2020",10,"Nos encontramos con uno de los mejores remakes del ultimo tiempo, Bluepoint hace mas que justicia a este clásico de PS3, sino que ademas se da el lujo de mejorarlo en varios aspectos, cuidando el mas mínimo detalle de lo original para que no pierda su esencia. Mejor soundtrack y aprovechando el audio 3D de PS5 se logra una mayor inmersión. Dejando de lado lo que es gráficos y rendimiento (los cuales son increíbles), en resumen, como fanático de FromSoftware aplaudo el trabajo de Bluepoint para revivir esta obra maestra y darle una oportunidad a nuevas generaciones de jugadores para que disfruten lo que fue y significó para la industria un juego como lo es Demon´s Souls. Umbasa"
395,Glanzmann100,"Nov 16, 2020",10,"Demon Souls é uma obra de arte, um dos maiores jogos da geração do Playstation 3 agora com um remake impecável, o jogo se mantém bem fiel ao original do Playstation 3 apenas mudando em alguns aspectos como por exemplo a musica de batalha contra os chefes, mas apesar das pequenas mudanças o jogo entrega uma diversão muito grande, o jogo contem também alguns troféus bem diferentes do que no original como por exemplo os troféus de desafio contra os chefes que mostraria uma forma alternativa de derrotar os chefes trazendo assim um desafio ainda maior esse jogo mostra uma historia muito bem elaborada, ótimas musicas, e uma bela direção de arte recomendo esse jogo a todos os fãs de jogos do genero. Obrigado"
396,SebasgamerX,"Nov 16, 2020",10,Un buen juego con graficas increíbles un buen RPG como el de los buenos tiempos
397,samtheham123,"Mar 21, 2021",10,its a remake what else can i say? great job bluepoint on reenvisioning this classic for the current generation of gamers!
398,leandraoadj,"Nov 16, 2020",10,"Best souls like game ever made, Bluepoint has done it again. Another great remake. Great gameplay with smooth frame rates and one of the great visual graphics in video game history. Games like this are the why PlayStation has always been better than Xbox."
399,mosesdark26,"Nov 16, 2020",10,"graficos incriveis, jogabilidade classica, a maneira certa de fazer um remake. meus parabens para a bluepoint."
400,Saimook,"Nov 16, 2020",10,"Masterpiece, so much detail and beauty in this game... very satisfying When you defeat boss"
