,User,Date,Score,Review
675,lovefromhate88,"Nov 20, 2020",10,Remarkable remake. Ignore the negative reviews. To be honest i believe DS is the sort of game where you know one way or another if you are buying it.Stunning in every way
676,Johnny-,"Nov 23, 2020",10,"A classic reborn. Undoubtedly one of the best remakes ever created, it stays true to the original while still improving its archaic mechanics and making it more pleasant to play. The visuals are outstanding, Bluepoint Games has very talented artists and cutting edge tech. The best showcase of what early PS5 games should aim for."
677,robber_soul,"Nov 28, 2020",9,"Having not played the original, I can still easily say that Demon's Souls is one of 2020's best games, and the best reason to buy a PS5. It's beautiful beyond belief, it feels nice to play, areas are appropriately challenging, atmosphere is thick, and the online components of signs and summoning means the game is only as hard as you want it to be. Barring a few little outdated pieces of game design, some undeveloped bosses, and a few moments of BS, Demon's Souls is still fantastic."
678,elraphael81,"Nov 14, 2020",10,"Piękny remake świetnej gry. Wygląda obłędnie, super klimat. Obowiązkowa dla fanów serii, a dla osób które chciałyby spróbować serii, to najlepszy moment ;]"
679,Tastet55,"Nov 18, 2020",10,"Main reason to get a PS5 alongside miles morales.  60 FPS feels phenomenal on console. Next generation, we here now"
680,Volchek,"Nov 26, 2020",10,"fantastic game, bluepoint has made a great job with preserving the gameplay, i think it's the best souls like ever made even if it's a remake"
681,Denisguitar_br,"Nov 25, 2020",10,"Jogo perfeito!!! Graficos sensacionais e gameplay top, experiencia com o controle dualsense e sem igual"
682,Xbox4life,"Nov 14, 2020",10,This game is truly a Next-gen game (even tho it's a remake) but god the graphics is perfect
683,Bulbul37,"Nov 14, 2020",10,One of the best game to start this generation thx to Sony and bluepoint. The game looks great absolutely huge W for Sony. This game should win GAME of the year ****
684,onfire1229,"Nov 25, 2020",10,"As a soulsborne veteran who has played all of FROM Software's titles multiple times, I can say that Bluepoint did a phenomenal job preserving the original vision of the game while brining it into the modern era. The mechanics are maintained and preserved (with some quality of life improvements that were very much needed) while the visuals and audio are updated in a way that makes the game far more immersive. I highly recommend this for everyone, whether you're a FROM Software fan or are new to the series."
685,lgqr17,"Nov 13, 2020",10,"Extremadamente bello y le hace honor al original hasta lo supera, simplemente una obra maestra para empezar la generacion"
686,lapara,"Nov 13, 2020",10,Perfect remake!! This game is one of the best remakes of demons souls. The graphics are very good.
687,onlygamer,"Nov 13, 2020",10,"Great game, one of the best remakes ever, the graphics, the animation, the sound, all is perfect"
688,Kumasimc,"Nov 13, 2020",9,"Once again I must point out that people posting Zero for their score have no business here. If you don’t like a game that’s fine, but a Zero just shows you’re a troll that no one can take seriously.Regardless, onward. Remaking a classic like Demon’s Souls is not an easy task. What do you change? What do you keep? Are there things that might not be great that are still essential to the experience? The devs have once again shown that they know how to modernize a classic while staying utterly faithful to its core. Much like Shadow of the Colossus, this will never replace the original, and I don’t think it aims to. One can easily still play the first, assuming you have a ps3. But not only is this an audiovisual treat for returning players, but a more streamlined entry point for newcomers. It’s still difficult, it’s still obtuse, it still has one of the most needlessly complex weapon upgrade systems ever, but it’s also the point where From took all of their knowledge from King’s Field and Shadow Tower and transmogrified it into what would become its own genre. Were it a brand new game, it would still be praised, as a remake it also deserves praise. It’s also going to be many people’s first time playing Demon’s Souls while the game is fresh and nobody has hacked it and duped their life away. The best time to experience the asynchronous multiplayer genius of Souls games, to me, is always towards the beginning, where we’re all in this together. So come, join, have fun, die a lot, call upon a stranger, leave a funny message, enjoy this masterpiece that went from swept under the rug PS3 game to Most Hyped Launch game for PS5 and see why it deserved a remake from Bluepoint in the first place."
689,Vidaloka118,"Nov 14, 2020",10,"Que jogo incrível! Com certeza o melhor jogo da saga souls já feito, os gráficos estão absurdos, é um dos melhores remakes já feitis."
690,Skspikex2,"Nov 14, 2020",10,"Tons of crying weak @$$ Microsoft fanboys trying to review bomb this game. So pathetic.Various video game journalists rate this game outstanding. And personally, it’s worth it."
691,viroodiem,"Nov 18, 2020",7,"While Demon's PS3 release is a generational defining game, sadly PS5 release is definitely not. Lets get this out of the way first. This is a REMASTER, not a remake. Many people seemingly have problem differentiating the two. A remaster is just a glow up of an existing game. Examples of this would be Final Fantasy 12 Zodiac Age, Shadow of the Colossus, Okami, etc. It will be roughly the same game, including using the original voice acting. A remake is rebuilt from the ground up and are FAR more rare because of the hefty investment involved with rebuilding a game is functionally not that different from building a new game from scratch other than having a blueprint to work from. With remakes you typically see whole encounters play out similarly but very different than their original and things like voice acting are created from scratch. I write this because there seems to be two wild camps here, both of which are kind of wrong in their rating. One is the camp 10/10ing the game, many of which did not play the original (as is evident in their reviews) and thus are giving the game a perfect score that is merely an echo of the perfection that was the original. On the flip side you have the 0/10 crowd who seemingly have fundamentally misunderstand what this release was going to be, and thinking it was going to be a remake. (although some negative scores are undoubtedly going to be from those scrubs that never played any of the souls games and just need to git güd as with all Maso/core games) Its importance to preface this to give proper context to this score and why other scores here are so way off the mark and basically useless. The graphics look slick and definitely a whole 9% better than PS4 graphics but ultimately thats the end of it. Its possible that had this been released in the middle of the PS5 life cycle that the graphic prowess might be as high as a 12% graphical improvement over PS4 graphics found in the likes of Sekiro or Dark Souls 3. There is effectively nothing else there to justify a 70$ price tag. Even if you are getting a launch PS5. In that sense what it does is serves as a VERY expensive tech demo for the early PS5 adopters. Essentially the ""more money than sense"" crowd. Even though that crowd is highly important to ensuring a console survives long enough to become profitable (looking at you, WiiU.) The problem with DSPS5 is that it does nothing new. Granted this is merely a remaster and not a remake (To that one dude talking about a ""reforged"", yeah, sorry but that is not actually a thing)  BUT there is absolutely no excuse for how high profile this entry was going to be to NOT add in the last pillar into the game. Bluepoint wanted to remain faithful to the original but if there was going to be no new content in the game the game should have only ran half its cost. All you are getting is higher resolution/framerate/texture/poly count and in the scheme of gaming, graphics are irrelevant to what makes a good game. So if you have never played Demon's, go ahead and get it. The game itself is outstanding. However if you have, then at best this is an honorific place in a library and I predict this will be one of those games that you will see for 10$ in gamestop bargain bins within a year to 20 months.... so long as Gamestop remains a thing. DSPS3 was a 10/10 game. It gets that score because a intangible part of what makes a game good is its moment in history. Remasters do not get that same luxury. Since 2009 an entire genre has been built around what DSPS3 set into motion and with it has been a host of advents and improvements to the genre. Those quality of life improvements are largely glossed over in the name of remaining faithful to the original. Sticking too close to the source material can be just as bad as it is good. The game looks pretty, it moves smoothly, There are SOME QoL improvments but it is VERY limited in presence and scope. it IS a slight improvement in ways not having the lag a PS3 would have BUT like it or not even those moments of lag ARE part of the experience. Think of it like how vinyl is viewed as superior to digital recording because of the ""warmth"" and that warmth being the tiny imperfections in the physical pressing of the record. The same is true here. So having a flawless, lag free experience is going to produce something more mechanical and a little less endearing than a 100% accurate flawless environment So it earns a 7 and to be honest 1.5 points of that are for nothing else than the hope that there will finally be DLC that adds in the missing pillar. (DLC which should be free I might add)  If that DLC ever does materialize then this score will be modified to an 8. Buy it now if you have never played Demon's before. Otherwise wait till it works its way down to a more appropriate 25-30$ range or it gets that last pillar DLC."
692,Ector,"Nov 14, 2020",9,"O game tem um gráfico incrível no modo qualidade, pena ser em 30 frames.Estou com cerca de 10 horas de game, explorando cada canto. Jogabilidade está boa.Daria 9,7. Realmente vale o game pela nova geração!!!"
693,Vicious23,"Dec 16, 2020",0,"Non ha una grafica next gen. Graficamente carino l, ma si vede che le texture non sono state fatte come dio comanda. Avevano già la base del gioco e doveva o semplocenre applicare un engine attuale ad un codice sorgente trito e ritrito. Peccato."
694,Deathboii,"Nov 24, 2020",10,"As a big soulsborne fan, I enjoyed this game. People who say it lost the ""atmosphere"" or isn't same as before are full of bs. I really hate the excuse of ""nostalgia"" they keep giving. Get over it; you'll never experience a game that you played before as if it was the first time. Anyway, I never played the original, but I've seen gameplay of it. And I wouldn't say I liked it. Same as dark souls 1, people also kept telling me its the best and most challenging soulsborne game. And when I tried it, it was the worst and easier compared to others. If you're a new soulsborne fan who has never played demon's souls, I recommend it to you. Though a little warning, ⚠️ it reminded me of DS2. Easy bosses but more difficult maps to walkthrough."
695,InjouMedjay,"Nov 17, 2020",10,"O jogo nos leva para um lado mais sombriu da Saga Souls , pra mim o melhor que joguei"
696,Xtreme1212,"Nov 17, 2020",10,"Sinceramente es una obra maestra, gracias a BluePoint por hacer de esta obra más grande. Es asombróso como se ve un remake espectacular"
697,EfrainGH,"Nov 13, 2020",9,Captures the essence of the original game perfectly. As always Bluepoint doing a wonderful job.
698,Mo3tez,"Nov 13, 2020",10,"Amazing remake grafically, nostalgie and yeah i remember how challenging this one was."
699,Lyanmatta12,"Nov 13, 2020",9,Ya termine el juego y me parece bastante realista a cuanto a su juego original y bastante leal hay algunos jefes que se sienten distinto a lo que eran en su anterior entrega
700,dlegassicke,"Nov 18, 2020",10,I've never played the original but as a fan of Bloodborne and Sekiro I absolutely adore this game. It's incredible to go back and experience the very first Souls game and see where the series started. Visuals are undeniably next generation running at your choice of 60 fps or 4k making this is an incredible way to start off the next generation of playstation. Well done Bluepoint Games.
701,Pyrucet,"Nov 14, 2020",8,"Visual, combat animation/mechanic and quality of life updates are exceedingly good. However, the new score and sound effects stray too far from the original and, while certainly loud and Hollywood-esque, are quite bland now. With the sound palette being pretty consistent over the entire souls catalog I don’t really understand why Bluepoint took such liberties there. The added NPC animations are generically terrible and immersion-breaking. Why bother bluepoint!? From didn’t. This game could have been a 10 if it wasn’t trying so hard not to be a 1:1 remake."
702,Rav3,"Dec 12, 2020",9,"Bluepoint Games has done a surprisingly great job of taking the grandaddy of Soulsborne titles and giving it a fresh coat of paint, without wrecking the foundation that made the game so great in the first place. In terms of combat, this is Demon's Souls as it has always been. New animations spice up the presentation, and add a lot of life to it's original counterpart. That being said, everything about the presentation just feels a bit different. It's not so much that the game doesn't look and play like Demon's Souls, but there are very subtle atmospheric changes that might offend the most pure of purist. Don't let that deter you though. This is the best modern way to experience Demon's Souls, and it's a visually stunning return to Boletaria. Umbasa!"
703,Killask,"Nov 21, 2020",10,"Still the best ""Dark Souls"" game, i loved the original PS3 Version and i will platinum this game again"
704,mythiiix,"Nov 22, 2020",10,This is a masterpiece. GO AND BUY IT NOW!! never give up and you will appreciate it at the end.
705,Stuvok,"Nov 18, 2020",10,"One of the greatest games ever made, is remade to look the way it always should have. Everything is enhanced and/or better realized in this new version. While the game plays the exact same as the original, the drastically improved framerate and new animations make it a much more enjoyable experience. One of the best launch games ever for a video game console and the only way anybody should ever experience Demon's Souls."
706,JohnnyJL96,"Nov 18, 2020",10,"Never played a Souls game before this one, all I have to say is that the game is one of the most difficult games I’ve ever played but, it was such a treat from beginning to end with incredible graphics that define what a Next Gen game should look like and giving us an incredible gaming experience I will never forget. Thank you Bluepoint games,"
707,Foolishghoul,"Nov 17, 2020",10,"Stunning remake from top to bottom. Graphics, animations, sound, music.  Everything is there and it’s fully realized. The loading times eliminate so much frustration and makes farming a breeze. If you love Souls games, definitely pick this up. You won’t regret it."
708,Kanwulf,"Nov 18, 2020",10,"One of the best games I've ever played! I once played in ps3 and now on my PS5, I hope some day do this whit the gow first games or metal gear."
709,SDB,"Nov 22, 2020",10,"This is a sensational game, and just incredible that it is a launch game. It is so wonderfully dark and addictive, and truly a rewarding experience."
710,FurionPS4,"Nov 21, 2020",10,"Wow I'm so addicted to this game! It's amazing. I love how it's a single player game where you can go and help or invade other players, while at the same time you take a risk if you want to summon phantoms to help you. The tenacity elements make this game so much better. I'm currently building a mage/thief. (I've decided. I'm going after Platinum Trophy, which will be my first plat. Wish me luck)"
711,NEOROID,"Nov 14, 2020",9,Where is the GODDamn CAT ICON??????????????????????????????????????????????
712,seilaaa1,"Nov 14, 2020",10,Perfeitoooooooooooooooooooooooooooooo caraleoooooooooooooooopooooooooooooooo
713,DaemonXHUN,"Nov 13, 2020",8,"[A realistic review - A faithful remake, but a missed opportunity] Aside from the obvious graphical overhaul and some minor tweaks and additions (e.g. the enhanced character creator and the respec system), this remake is essentially identical to the 2009 original mechanics and content-wise. Therefore it's quite mind-boggling how it can have a higher critical score then the version that came 11 years prior to it. Demon's Souls is still a competent and quite enjoyable game, it's basically a rough blueprint / prototype for the other SoulsBorne games that followed it and it actually does some things better than the subsequent titles, like the boss fights that are actually unique and each have an interesting mechanics or idea tied to them and not all boss fights boil down to ""roll away from attacks than hit"". But it also shows its glaring problems and strange design choices with its age, especially in this more modern form. The Grass-based healing system is bad. It can either make the game needlessly easy to the point of zero challenge, or needlessly grindy - it should have been replaced with a system similar that is in the newer games (e.g. the Estus Flasks from Dark Souls). The World Tendency system should have also gotten a significant overhaul or even rework, because it simply doesn't offer enough choices and opportunities for the players' to reliably change Tendency levels (especially if they play offline) and because of that, they can miss out on a significant amount of content, especially if they are new, unexperienced players who are unfamiliar with this system. The high importance of the Luck stat here compared to its relatively minor importance in other SoulsBorne and Soulslike titles is also very problematic, especially because the game quite simply doesn't have enough content (areas, enemies etc.) in order to justify the existence of a stat like this and/or this stat to be able to work like it's intended. There are a lot of specific materials that can't be found through regular play and exploration so if you want to go for a certain build, chances are high you'll have to invest a significant amount of time to farm them instead of actually steadily progressing through the game. The last major problem with the game is that a significant amount of the areas simply aren't particularly interesting or fun. Of course, nearly all (if not all) Souls titles have problems with some of their areas (like Blighttown and Demon Ruins in Dark Souls, or Forbidden Woods and Nightmare of Mensis in Bloodborne), but Demon's Souls is full of underdeveloped, way too narrow and repetitive, or simply uninterestingly designed areas like these. I'd still recommend the game though. It's a Souls-like so you know what you'll get. Tight controls, possibly challenging gameplay, cryptic storytelling and worldbuilding, rewarding exploration etc. And as a remake, this game is basically perfect. I just wish that the developers at Bluepoint Games would have done more with it. I wish they would have fixed the game's main problems and perhaps create a new area for the 6th archstone. To me, this game is a solid 7 out of 10, because I have played this before multiple times and I do not consider the remake as a huge improvement, but for new players, I can see how it can be a better experience, hence why my final rating is an 8 out of 10."
714,Gurumederin,"Nov 22, 2020",10,"Amazing remake! It really feels, looks and sounds like a true next-gen game."
715,ronnielsen,"Nov 21, 2020",8,"If you like Souls games, you’ll love this. It’s by far the best looking game on PS5."
716,HitIerDidNuffin,"Nov 13, 2020",6,"Is this game bad? Certainly not. Is this a faithful remake of Demon's Souls? ABSOLUTELY NOT.I went in expecting Demon's Souls and what I got was a mix of Nioh and a generic Souls style game. The art style is far from the original and it shows that the people in charge did not understand the art style of the game and much less the idea behind the characters. Rather than remaking Demon's Souls I feel like Bluepoint attempted to push this to a more casual audience mixed with newer Dark Souls fans rather than remaking what is still an amazing piece.Fun game, however I would never call this a faithful remake."
717,Eissa1996,"Nov 25, 2020",10,Oh my god just like the ps3 version this one is truly a work of art amazing all around a game that made its own genre the original was already a masterpiece and this is even better a  system seller indeed
718,Abvaveragegamer,"Nov 18, 2020",10,A great remake. A whole new experience while still being faithful to the original.
719,InsanePT,"Nov 17, 2020",10,Simplesmente magnífico...bp mestre em fazer remakes e remasters o jogo está lindo demais junta o novo com o antigo e a nostalgia continua sendo a mesma do original.... parabéns pelo excelente remake ❤️❤️❤️❤️❤️❤️❤️
720,Theplank,"Nov 14, 2020",10,love playing the original on PS3 brought back so many good memories its amazing and dammm its looks sooo beautiful
721,jj98891,"Nov 14, 2020",10,This game is amazing This is by far the most beautiful game I've ever played Im so glad Bluepoint Games brought this masterpiece back. Demon's Souls has a unique place to me
722,Abovewater,"Nov 13, 2020",9,"Among a sea of fanboys on both sides, this review is the safe haven you are looking for. So hello my friend, stay awhile and listen. Scrolling through the abyss of reviews on here, my eyes were being assaulted by demons. I looked to the left and see ""SoNy SuCks, 0 out of 10"" I then looked to my right and saw ""SoNy iS ThE BeSt 10 out of 10"". It was at this moment I realized I must undertake a quest and purge the Metacritic of these Demons. I see the Old one, the greatest demon of all, his fog has now reached the gates of our real world and is affecting poor souls in this world. Remember, a hunter is a hunter, even in a dream. Let us purge the dross away and begin with The Good. Visuals. Demon's Souls for PS5 is an absolute visual feast. The attention to detail is simply breathtaking. Every brick has character and life in it. The fire affects are the most realistic fire effects I have ever seen in a game. The actual character models look like real people and not horrid creatures. One example of great detail is dragon fire breath hitting a wall and starting a banner on fire, and you can watch the banner slowly burning away on the wall until it disappears. And that's just in the background, it wasn't pointed out to the player specifically by the game. It is something a lot of people could miss, but they put that kind of detail and effort into it anyway. The environments look stunning and make you believe this place really exists and truly pulls you into the world. The sounds, especially the 3d audio are just as good, if not better than the visuals. The sound effects are absolutely amazing. You can hear the bone crunching on deep hits such as backstabs and ripostes. The audio sounds very crisp and clean. Audio really hasn't sounded next gen until now, just a layer of depth that brings everything to life. The controls. The haptic feedback and rumble are great features. Every hit you can feel. But it's the depth of it that is amazing. Hitting a wall with your sword feels a lot more different than hitting metal armor, which again feels different from hitting flesh. You can even feel it when you are running on sand, the controller rumble gives a subtle feeling of running on sand (hard to believe and describe but its there). When enemies are about to throw fire at you, you can feel the rumbling of fire permeating through the controller. Actual controls are very responsive and intuitive as well. Performance. Playing this game in performance mode is silky smooth. This game runs at a locked 60 fps, with only very tiny occasional drops to the framerate which rarely ever happen and aren't very noticeable. This game feels like playing butter, if butter was a game in which one could experience. But very smooth gameplay and responsive gameplay. Okay now on to the bad. There are a couple things in which I want to address. I personally do not like how some of the menus, text and hud look. It's a personal opinion but I feel it is very generic and doesn't have much ""soul"". It especially stands out cause the rest of the game looks phenomenal. Some of the voice acting is a little bland. Especially compared to the original. Even when some of the original people were brought back to voice act, some of the iconic lines don't have the same feeling to them anymore. The other thing I want to address is having exclusive content locked behind buying a pre-ordered deluxe addition. One of the weapons especially received is extremely OP with almost no stat requirements and does a lot of damage and has crazy reach. I feel this is wrong to do to players and consumers. Other than those things, this game is truly an amazing game. Whether you are new to souls games, a veteran of souls but new to Demon's Souls, or an OG Demon's Souls player, this game is truly an amazing game and worth playing. If you are new to Souls, this game will be a challenge, just a warning. So that's it, I know this review is longer than 2 sentences like 95% of the reviews here. But if you are reading this, it means you have a brain and are choosing to read something a little different. Thank you for reading. Remember that you have a heart of gold, don't let them take it from you. Praise the Sun and Umbassa."
