,User,Date,Score,Review
339,Flashcam,"Nov 30, 2020",10,"If you've played spiderman on ps4 or already own it I would say that this bundle may not be worth the sticker price.  However, as someone playing my first game on the new PS5, coming from Xbox this game is fantastic.  It's been quite some time since I played through an entire storyline along with side missions and actually finished (most) of everything.  The storyline, while it is short as many have pointed out it's a great 7-10 hour experience.  The story did a great job to develop the character of Miles, and make the player root for him.  I think Miles is a great character, and they do a great job of showcasing his life and making him relatable to everyone.  While I can't review the original game here, if you do not already own it, that definitely adds to the value of this game."
340,J2ise,"Dec  9, 2020",6,"This game is beautiful and fun to play. We finally get more air tricks since Spiderman 2 back on ps2. Here's my opinion and this game is a DLC, it feels like they did us and Miles dirty because this game was not fully flushed out the story was not hard to predict and sure enough it went exactly as i assumed now we paid for a DLC the price of a triple AAA game. Wait for a sale don't pay full price oh and by on ps4 2 for 1."
341,goodguymate,"Jan 17, 2021",8,"This game was my entry game to the Playstation 5 console and I really did enjoy playing it.Graphics and Visuals: 9.5/10Audio: 9/10Character movement mechanics: 10/10Story: 4/10I would say the game is worth its price. A nice, casual experience - also fairly easy Platinum trophy, but you will have to finish a new game+"
342,moeiscool,"Jan 26, 2021",0,"They shouldn't have sold it as a separate game. They should have sold it as DLC to the first game since its not really a new game. Too short and the differences are too little. Combat is pretty much the exact same. Really though, If I wanted to play the Spiderman for PS4 thats what I would have done, why re-release the same game and call it something else? greed."
343,Tkdbarros,"Jan 27, 2021",0,Game patetic................................................................
344,MacG,"Jan 28, 2021",7,"It's very good and plays very much like the previous title, but other than a shiny graphical update this is just a shorter version of what we got in 2018. Well worth picking up once it goes on sale but difficult to justify at full RRP considering it has less content than the original and takes place in the exact same areas of the city."
345,Godbox,"Jan 30, 2021",0,"Un juego penoso y aburrido, lo termine en 2 horas y me quede con ganas de mas, sin duda 80 dolares a la basura"
346,AlexCarbone,"Jan 31, 2021",3,"El juego es extremadamente corto. Si eres rápido, en 3h30 te lo pasas. Es una broma que un mundo abierto dure 3h30. Si vas despacio y te entretienes no llega a las 6 horas. A 59 euros de salida es una gran decepción. Recomiendo comprarlo cuando esté a 20 euros. El juego es bueno pero 3 euros de Gameplay...pues no. Bugs tiene a montones, algo que no pasaba con Spiderman."
347,Daniel219,"Feb  4, 2021",5,Decepcionante para ser un juego de nnueva generación. Fácilmente lo corre la ps4
348,HappyNebula,"Feb 23, 2021",10,"Miles Morales is another great hit by Insomniac team, they nailed the narrative, characters, visuals and gameplay. It’s a game about social/cultural diversity and representativity brought to a universe of a beloved super hero in a videogame. It’s a game about living in community and respect for each other. It’s a game about self-learning and understanding how to self-accept. An approach that is important nowadays and something that we need to see more often in videogames. All of the aforementioned characteristics of this game are expressed by the many great characters and how the narrative unfolds between them, either by doing the main quest or side quests. Alongside the well written narrative, the performance of actors/voice actors are top notch with a well-done animation too. Yes, it is not a long game, you can complete the main quest within a few hours, but you’ll probably want to do all the other things like side quests, challenges or just explore the gorgeous New York city in winter. This will take a few dozen hours more. And it’s definitively worth it. This game is visually impressive on PS5. Seeing the ray traced reflections of the buildings while you swing around the streets of New York with a buttery smooth 60 fps is simply amazing. The ray tracing reflection is just not about visuals, but also helps with awareness of the environment and enemies. And talking about awareness, this game also does a great use of the 3d audio (tempest engine), it adds depth and precise placement of the sounds, making it one of the most immersive city that I ever heard in a game. Don’t forget to turn this option on in your PS5. Another technically impressive achievement is the absence of loadings time. It’s so good to jump into the game with almost no waiting time or to fast travel in a blink of an eye. Regarding gameplay, Mile Morales uses the same great mechanics found in 2018 Marvel’s Spider-Man. Miles performs swings with more acrobatics and have his own set of abilities. The combats still fun and traversing through the city is always very pleasant. I just think they could use the adaptative triggers and haptics of DualSense in a more profound way. It’s an OK application. In summary, this is an excellent spin-off to the Marvel’s Spider-Man franchise. All that you loved in the 2018 game is also in Miles Morales. It’s a PS5 must have. And I hope that Insomniac Studios keep up with their great work."
349,thechetearly,"Mar  1, 2021",10,"Yes, it is a short game. But...it is a genuinely fantastic game. The graphics are outstanding. I found the story to be super sincere and interesting. I would highly, highly recommend!"
350,Demonio10,"May 21, 2021",0,"Donde estan los ciudadanos? la ciudad se nota sin vida, ademas ps5 hace un ruido tremendo cuando lo juegas. Un desastre de juego pero peor aun es la ps5. Tengo ps5 y SeriesX, vendere ps5 porque es la misma mierda que ps4, solo que mas grande, y no es una consola de nueva generacion."
351,MakwLoQ,"May 18, 2021",6,"Wow, a tiny little adventure from Sony and a great show off of the Ps5 hardware. Before i review this i must ask you [if you are wanting to buy it] to wait for a sale, this game was incredibly quick and i 100% it in 2 weeks. But without further ado' here's my review. Now the first thing you notice in a game are the graphics, and this game is eye candy, the first game ive ever played in 4k and there has yet to be a game that is better looking than this one, it is one of those rare games where the graphics are on par with the trailer graphics especially when performing a finishing move you really get to see the fibers of his skin so smoothly. But the graphics truly look the best in photo mode, i have looked online and it is truly incredible what some people have done with it, recently sony has added an update for miles muscles making photo mode 2x better, times square is a go to place for photo mode especially when using a reflective suit. even when standing on a pole you can still capture a beautifull photo showing off the themes of new york. Now lets get onto the combat, where this game shines in. The combat makes you feel so powerfull, as soon as i started fighting i emediately started spamming triangle[in the first game you could just counter and dodge anything with it] it sorta worked and i got hit a few times but when you start messing around with those powerfull purple weapon guys you really need to start fighting properly and figure out how to get past them. But the combat is so smooth and clean, it was so much fun and honestly some of the most fun ive had in a single player game for a while. But whats fihgting without a big bad guy to fight? The villians are dull and genaric, the rhino fight was fun the first time but efter fighting him so many times it started getting boring and just unthrilling. The prowler was kind of a thrill at first, hes more of a guide to miles in the beggining teaching you about many gadgets witch will allow you and help you to progress in many situation but towards the end he just turns into a filler so they dont go more than 2 hours without a boss fight, i understand that prowler is miles uncle [not a suprise ive already seen the spiderverse] and is trying to stop him from going to fight but it just falls flat and the fight is not something memerable at all. The tinkerer fight is another plain and simple one, not anything that is too special its more of dodge and hit, once youve memorised here abilitys shes as good as yours to beat, not really emotional considering how short the story was you didnt have much time to bond with her. A not very memorable story and right off the bat spiderman is beaten badly by rhino althoug last game he beat 4 villians and doctor oc at the end of the game. So roxon pulls up and you emmediately know hes the bad guy in this game, i feel like this couldve been done better but i guess they needed filling in their 7 hour game. To shorten this up its a goose chase witch leads you to the final battle, the ending is supposed to be emotional but if they introduced her in the first game then i would have at least felt something but this just fell flat and really ruined the emmersion. A generic superhero story, theres not much to say about it, it just sucked. If they would have worked with another studio it could have been longer. in roxons evil layer i just began to cringe at how generic all this stuff is, although towards the end it did have a cool moment of miles fighting against the machine power orb thing. Speaking of miles, whats a game without a main character? First off, Miles voice is extremely annoying in this game and i turned down the volume of my tv, i understand miles is young but really? constant voice cracks? I really feel like they could have done more with him, his powers are cool but it also leads to the generator missions, no variety in those and i began to groan every time he had to ""Fix the generator!"" like goddam did that get old quickly. The henchmen got old real fast as well i began to refer them as the purple guys and the red guys. But anyways miles needs to learn how to handle his powers witch he does emediately. He figures out his friend that we know nothing about is the tinkerer witch he is all confused about for around 30 minutes. Theres alot to say but in short, they missed an oppertunity to put in memorable new characters and does not have enough bonding moments with the characters, it was too short for me to enjoy it because as soon as it started getting good, it was over."
352,Marvin87,"May 25, 2021",0,"Jeu complètement bidon, trop de bug, graphisme à la ramasse. Gameplay simpliste. A éviter à tout pris"
353,Eatt,"Jun 26, 2021",6,"Great gameplay, combat and mainstory. Lame fetch quests (tons of them), boring side quests, very short."
354,MidnightRaven,"Aug 15, 2021",10,This game is dope af. It doesn't reinvent the wheel with the 2018 Spiderman game but does polish some things. It isn't very long but it's def quality over quantity. I personally got the platinum to both 2018 Spiderman and this game. Puerto Rican culture is shown even in the smallest details. I recommend to get this game at discount.
355,somegoodstuff,"Aug 22, 2021",0,"Very weak game, awful boss fights (there's hardly any) and overall just same city with snow. Very meh."
356,TheReal_Truth_,"Aug 22, 2021",0,This should have been dlc i can't believe they sell it as full game while it's same city with nothing new.
357,Vlados1Na,"Aug 26, 2021",4,"В отличие от паука 2018 года, майлз показывает хороший старт и пару миссий которые западют в душу, но игра на столько короткая, что ты не успеваешь начать сопереживать персонажам и я сидел с покерфейсов в конце игры, геймплей стал тоже хуже, нету такой вариативности гаджетов, советую брать только по серьезной скидке"
358,ApexPredator87,"Sep  6, 2021",0,"This spider man game came with my ps5 and miles just makes me cringe. The gameplay is not bad but game is bloated with to do chores crap in an open world. All the stuff seems like a chore and not an immersive experience me.. I am going to sell this piece of crap. Yeah miles the kid is that cringe I deleted it from my hard drive… sorry, but it really brings absolutely nothing new to the table either."
359,LuisDF04,"Sep 11, 2021",1,"hate the main character, not because his race (okay maybe a little bit) but hes so irritating, come fight me if you want @LuisDF04"
360,Edison76,"Mar 11, 2021",9,"Quel plaisir que de parcourir ce jeu. L’histoire est très sympa, Miles est attachant et la technique est au rendez-vous. Graphiquement le jeu est superbe sur ps5 et l’ambiance vraiment bien retranscrite. Alors oui, il est plus court que son aîné mais il est du coup plus dense"
361,Lluch,"Nov 24, 2020",7,Fun game with very good technical development. The only let down part its that iS REALLY SHORT. I've completed 71% of the game in 6-7 hours doing a few side missions...so like a 10h story...with WAY TOO similar main missions...doesnt deserves a better grade. 7/10 bc is fun and beautiful.
362,tdebug,"Oct 11, 2021",0,"What a mess. Everything is so fast, you just need to press random buttons to fly around. No system, no technique. How old do you need to be so that would be fun."
363,ReubenIsAGod,"Dec  8, 2020",8,"I recommend waiting for the game to drop in price before purchasing.I LOVED the story here, it really worked for me (the biggest weakness being the short length and not enough time to really feel a certain conflict with the main villain) I also found Miles as Spider-Man much more enjoyable and compelling compared to Peter (he gets really annoying in this game...I think it's the new Face Model, it doesn't work for me)I also really enjoy how simple and sweet a lot of the side-content is....however...This is way too expensive for what you are getting. This is (essentially) just 1/3 of a game for roughly $100 NZD dollars.I would seriously consider waiting till the game is around the price tag of 40 - 50. Overwise purchase another game with more content. I could honestly justify spending 40 on this, but 100 NZD was way too pricy. *Updated*I have to know 100% this videogame. I really really love this aye. Like damn, every side quest in this game really adds to the story (even the collectibles, you get fantastic little bits of dialogue and story fleshing out through them) The biggest flaw to these is definitely just the sameness of them. Otherwise, I'm rather quite excited to see where they go with the sequal. Gonna bump up the review to a solid 8.5/10."
364,OwtDaft,"Dec  9, 2020",7,"+- Pretty much the same deal as the main game.+ Side content slightly less copy and paste- The game is pretty buggy, but not to the point of ruining the game..- Oddly the developer used the game to show their support for a violent hate group."
365,Lotfi09,"Jun 12, 2021",9,Awesome start to the next Gen !!!! Roll on spider man 2. Didn’t think I would like it as much but Miles is his own spider man.
366,dilemma,"Nov 25, 2020",9,"Awesome ! Let it be known I have not played the Ps4 version yet (Amazing Spiderman) If you haven't played either... Well.. Miles looks and feels amazing.  If you have a high end 4k HDR TV, playing the game at 30 FPS is actually really nice, but you can swap to 60 for framerate.  The game looks beautiful.  A lot of the Quick time events, or story missions, seem to render at a higher quality (Think first 15 minutes of Last of Us) and it's incredible. Thoughts: I don't play a lot of single player game, nor do I beat a whole lot either but two titles that i found extremely fun and worth my time is Infamous: Second Son and Miles Morales.  There's a lot of quick time events, but they are fun and exciting.  It takes place around Christmas time so you get to swing through a snowy NYC.  This adds an extra touch considering there will be a lot of gamers playing this on Christmas Day. Strengths.  Gameplay, it's smooth.  Think Batman basically.  Swinging though the city is easy and feels extremely rewarding when done properly.  It's so much fun to run up a sky scraper and swing in-between building.  The game environment (City) looks amazing.  You will be amazed when climbing the Empire State and looking over an seeing all the building in high detail! I like how easy it is to do side missions.  They pop up on the ingame phone app and spawn randomly when you are close by.  I also enjoy collecting the ""Time capsules"".  Fun lore. My biggest con is lack of boss battles.  I think there's 3 in total but it feels about 1.  Story could be better?  It's over the top.  I don't think it was necessary.  The collecting of the sounds clip is an interesting mechanic but felt like it took me away from my game, or at least really slowed me down when I was trying to progress. Story:  Basically a love story with good and bad undertones.  The ending is a bit of the top.  There's a twist or two and were enjoyed. Characters: Are ok.  I am not a huge fan of Miles but he's a good hero who always does the right thing.  His relationship with the female protagonist is interesting. Movement: Smooth and fun.  No real complaints.  Swinging is a blast, combat is great. Extras: Challenges, Time Capsules (Collecting), Collecting the sound samples, Crime and other tasks done by the in-game app P.S.  Giving a game a low score because it is short is a terrible way to bring down a rating. Price and Time doesn't make a game a good or bad.  That's more of an issue of investment.  I would feel more comfortable spending $50 considering Amazing Spider man is a Ps4 title, and there is a short campaign (but it's packed) and was a launch title.  This won't be effecting my score as it shouldn't."
367,chr1so,"Oct  4, 2021",8,"Spiderman on ps4 was one of my fave games of all time, and while this one is not less good, it doesn't add a whole lot imo, & very short.They've clearly used Miles & friends to shoehorn in some minorities but it's pretty seemless, so props to them for keeping both sides happy & not ruining the franchise at the same time."
368,n_dhruvo,"Dec 17, 2020",8,Got it in ps4 pro and platinumed it. The game is fun. Cant deny that. But it is not as good as the previous one. Miles morales is a great character. The developers and writers did a great job creating miles. He does feel like a peter Parker clone. While peter is more combat focused niles is more stealth focused. He has cloaking ability which basically breaks the game. Cloaking makes it very easy disappear from enemy sights. The main story is pretty weak and short. It can be completed in 20 hrs.
369,guiletheguiles,"Dec 23, 2020",7,"Spider-Man Miles Morales is a good game. Short and sweet, while not being a major improvement over its previous entry. One thing that I want to get out of the way first: The graphics are gorgeous!The first Spider-Man game, on base PS4, already looked amazing, but this is definitely the most significant improvement over the original.And not only it looks good, it also plays great! Swinging around the city is still a joy, the fast-paced combat system continues to excel expectations and unlockables like new suits, gadgets and skills feel very rewarding. The story is also great. While not as involving as the original game, I felt like Miles' story is much more personal, with freedom to take the character into different and more original paths than the ones we've already seen in other Spider-Man media. Great voice performances, exciting action moments and emotional cuts make this game worth picking up. What hurts this game, in my opinion, is the lack of novelty.A few things that I did not like in the original are still here. And since this is a much shorter experience, these things just get in the way of a great story being told.Side quests are still repetitive, but this time they don't add anything cool to flesh out the Spider-Man mythos, like the previous game did with some of them. The lack of enemy variety is sad and in harder difficulties, they still take forever to die.And the worst thing in the entire game: THE PUZZLES!They get old quick. Basically, they turn Miles Morales into a walking ""generator energy"". It's absurd! This game is very short, so buying it at full price might not be the best idea, but if/when you do pick it up, you'll definitely have a great time, whether you're a Spider-Man fan or just a sucker for good Action Adventure games.Now, if you've played the old one, you'll probably reach the credits with the taste of an overglorified DLC, in your mouth..."
370,Ohman,"May  5, 2021",8,"Beautiful graphics, smooth game play but little to short for me, the new mode  60 fps with ray tracing is wonderful!"
371,ragerino,"Feb  6, 2021",9,The readon I am not giving a 10/10 is because gamers like me who alrewdyvown the original Spider-Man had to rebuy the game to enjoy it in 4K@60FPS.
372,Voodoo123,"Dec  8, 2020",7,"+More great Spidey action gameplay moments+Excellent cast+Excellent soundtrack+Short but decent campaign-Open world 'busy work' feels disrespectful to player time-Plot feels far too bare bones considering the wealth of material they have to work from...-On ps5 feels very much 'last gen' in terms of visualsEnjoyed my time with this although it is a bit short. While graphics technically superior to ps4 pro, it's not THAT different to blow you away with it's visuals... Overall I would recommend to marvel fans. Might be worth waiting for a sale."
373,mfmaxpower,"Apr 14, 2021",9,"Biggest complaint is I wish it was longer. Also wish the world and side missions didn't feel so generic. But great story, great visuals, great combat (though it needs an update), and just a lot of fun."
374,DrZomboid,"Jun 22, 2021",7,"Short, solid, good looking game with cool cinematic combat. Puzzles can be a bit boring..."
375,SuperkenGaming,"Jan 20, 2021",8,"Marvel's Spider-Man: Miles MoralesThe exaggerated swagger of a young black teenIs it a full game is it not a full game, this is the question.. nd the answer is.. no…I don’t care what anyone says… Miles morales is a 6 hour long expansion to 2018’s spiderman, theres nothing wrong with that.. but that’s what it is and feels as such.. more of the same, though this time you play through the very rushed story of Miles Morales, who is left with New York city in his hands to take care of while the og spiderman goes to hangout with his boo. Obviously there are tons of collectables and pretty okay sidequests to do around this 6 hour long story, but since it feels like more of the same.. I didn’t care too much to do what felt like, heres more content patched into that game you really loved 2 years ago… though to mix things up, miles morales feels more like batman mixed with spiderman, and I love that, my favorite moments of the arkham games is lurking in the shadows and just snatching fools up, and its just as satisfying here to clear a room without engaging in combat.. and I was mostly pushed towards that because sadly the combat just isn’t satisfying here, don’t get me wrong, it stylish and flashing, you feel like a true hero when you pull off perfect combos, and you alredy know the swagger is exaggerated, but the enemies feel like sponges stopping miles mroales from feeling as satisfying as it could.. which again kept me away from doing too much side activites, im either going to be suffering through the spongey combat, or im going to be doing some dragged out puzzle of connecting electricity with my web…Miles Morales is definitely a great game, with great characters, its beautiful, the music is amazing, and it tells a really touching story, but this is really just a really well put together expansion… no matter what anyone says.but with that being said, it’s a great expansion to an amazing game, one with mechanics that feel smooth, the most fun open world outside of an assassins creed gameAnd with its own platinfum trophy and the $20 discount, I guess that’s okay.I give Marvel's Spider-Man: Miles Moralesan 8/10"
376,doncsoo,"Nov 23, 2020",9,"Pros:-amazing gameplay-next gen graphicsCons:-bit short, yet quite expensive-still isn't clear how miles manifested his powers xd, though these mechanics are fun NOTE: I haven't played the first game. Maybe it was more enjoyable this way."
377,rosnk30,"Mar  5, 2021",8,"Miles Morales is a nice game with fun moments and good storyline. Anyway, MM had few hours to finish  (aprox. 8 hours) and the ps5 system enjoy full of power using ray tracing and 60 fps. Good game but if you play the first SM this one's like DLC after all"
378,Necrophat,"Sep 13, 2021",9,"An excellent game, around 7-10 hours for the main story, more if you want to do the side questions/collectables etc. It's funny seeing poor reviews based on the games shortness, this game came out not long after Spider-Man 1, it wasn't marketed as Spider-Man 2 or anything like that, it's a shorted condensed story, the game is excellent. People expecting 20-30hours all of the time, sit down."
379,SuperDuck23,"Jul  6, 2021",9,A brilliant spin-off sequel that maintains the high standards of the original 2018 game. The gameplay is more or less the same but that isn't a problem when it's so much fun. The story and characters are the strongest point of the game for me - which kept me intrigued all the way to the satisfying conclusion. It doesn't outstay its welcome and is a nice game to play during a short holiday break.
