,User,Date,Score,Review
479,DomTheBomb28,"Feb 17, 2021",8,"Spider-Man PS4 was a game that had the crowd going wild. Nevertheless, the game was awesome. 2 years later, its now Miles's turn to take the wheel while Peter hits the backseat in the spin off titleSpider-Man: Miles Morales. First off, we cant go too in depth without talking about the impact the PS5 brings to this game. With 4K graphics and two graphic options, the game just looks gorgeous. Playing on the butter smooth 60fps Performance Mode, or taking the other route and playing on Fidelity Mode, which drops the frame rate to 30fps, but makes up for that with the jaw dropping ray tracing. Either way, your getting the full next gen experience. Now, its story time. In this Spider-Man title, The veteran Spider- Man, Peter Parker, is taking a break and going away for two weeks to assist MJ in Symkaria, he then leaves Miles the task of being the only Spider-Man that NY will have. During this time, Miles discovers the Underground, a high tech organization that is going after Roxxon's new energy source, Nuform. Its now up to Miles to take the lead and discover the true motive of the Underground and put a stop to their movement, while finding out what it means to be his own version of Spider-Man. While the story has nice depth and meaning, its very short. People were completing the game in a day which isn't great for a game like Spider-Man. Most people worried about this game being a copy and paste version of Spider-Man PS4, however, it is far from that. The web-slinging has never felt better thanks to the DuelSense controller's adaptive triggers. The way Miles moves when swinging gives you the feel of a younger, mid experienced Spider-Man rather than Peter's older, veteran, Spider-Man. When Miles's web zips to a certain point, you can see him trying balance while landing. The little animations give you that ""This is a different Spider-Man"" feel. Miles's new bio electric Venom Power, Camouflage Power, and Gadgets, play a major change in combat when it comes to its heavy use in there respective scenarios. The skill tree gives a wide selection of new abilities too. The suits in the game are amazingly detailed, no matter how basic the suit looks. Each suit mod brings something special to the table, and yes, I'm looking at the Into the Spider-Verse suit mod. For future DLC, its safe to say we would all love to see more fan favorite suits come into the game. The photo mode in the game is so outstanding and easy to use just like in the first game. Pose Miles's in many different ways and use funny filters and stickers to create silly and cool photos, or use other graphical filters to recreate scenes from your favorite Spidey film or just make a badass photo in general. In all, Spider-Man: Miles Morales is a great way to show the power and potential of the PS5, however lacking in story length and bosses. Nevertheless, still also kicking off the new generation of gaming with other awesome titles."
480,sh1ngek1fan,"Nov 22, 2020",8,"A great follow up to Insomniac's first Spider-Man game, Spider-Man: Miles Morales is a fun time with great gameplay and a good story with loveable characters. Graphics are improved from the first game and combat is still a lot of fun. I also enjoyed the game's take on characters like Miles, Genke, the Tinkerer, and the Prowler. The secondary villain is pretty generic but at least he's played well. My only big criticism is the redesign of Peter Parker's face. I liked the old design and not only does the new design make Peter look way younger than Miles, when he's supposed to be a mentor, but it looks too much like Tom Holland. It seems like Insomniac was trying to appeal to Marvel fans here when the old design was its own thing and didn't need changing. Still, this issue did not ruin my enjoyment of Spider-Man: Miles Morales, as it is a great game. It is a lot shorter than the first one but is still highly enjoyable."
481,MANXMAN76,"Oct  1, 2021",6,"TBH I found this boring the game felt way too short, the combat is too easy as well as stealth, the suits feel underwhelming, recycled bosses and adding snow and some Christmas decorations didn't make the experience any better, the music was ok, the voice for miles at times felt whiny and the game should be double the length this should have been a dedicated miles game with new villains and ecstatic gameplay for the ps5 but instead it kinda fell flat let's hope that they go all out on the next spider-man and wolverine games."
482,Unicron666,"Jul  3, 2021",4,"The gameplay was good but it only keeps you interested for so long, the story sucked, the side characters were eye rolling and mostly unlikeable and the whole game was really short (although this turned out to be a bonus as I was fed up with it quite quickly)"
483,illuvatar_1st,"Apr 20, 2021",8,"The game is the official sequel to the Marvel Spiderman 2018.It is NOT just a reskin and Miles and New York are very different than the other one . The game is an improvement in terms of gameplay however it has one MAJOR FLAW.....The story is the 1/4 of the original and as a result i cannot seem to care about its story. To elaborate ,Miles is already a well established entity on the series from the 1st game however all thee rest had to have some introduction and development.However i personally went out of my way to do all optional interaction, side missions and collectables to get to understand miles struggles BUT before i knew it the Game was over.Climate scenes did not feel right.Here's an example ... When peter was struggling near the end, we (Gamers) cared about his struggles and pain as we get to experience all of it throughout the campaign. We saw his relationships, his guilts, his struggles and pain, however in Miles, we re thrown into a cutscene, we were told  this is what you should believe and there we go. Overall it's a good game whose only drawback is the Short story."
484,AlexandraCapo,"Apr 29, 2021",10,One of the best superhero games ever made! I love how much more fluid Miles' moves are compared to Peter in Spider-man PS4. It's incredible how Insomniac Games have done this ❤
485,VlueStar,"Jan  4, 2021",4,"The game is ok but they could’ve done so much more... The story is not interesting, and even when it is it still feels lackluster and misguided. The main protagonist reminds me of Nadine in uncharted 4 when she just beats down the player in every cut scene they have. I mean it’s effective storytelling, but highly unlikely, and a strange choice for the main plot. She’s also probably the least interesting character they could’ve chosen from the spiderverse, and everything is she does is cliche af. You can beat the game in like 3 hours if you want to, because it’s literally like 5 missions and your done. They made a short game and still put out of suit gameplay in it... I feel like I paid for a fleshed out demo rather than a full game."
486,Boozix,"Nov 25, 2020",5,"The Game is good, you have fun playing it, but honestly way too short, near to zero known bosses and a scenario that would fit in a single toilet paper. It's basically a DLC so paying 60€ for it is crazy. With real bosses, durability and a proper scenario it would have been an 8 easy."
487,Bartholumu,"Nov 20, 2020",9,This game is just pure amazing! The score in this game is just a nice touch as well. Something that I also enjoyed was music playing while you swung around New York City. I am someone who likes to 100 percent these games and I have played 14 hours and I’m still not done. I understand that the game can be short but so can the first Spider-Man game. If you just go full story for the first game you can beat it roughly 7-8 hours. These games aren’t made just for you to speed through the game the game highly encourages you to explore the map get the skills and tech parts which are beneficial later on as you play. This game is just as good and a nice “expansion” to the first game.
488,Flashrick,"Dec  5, 2020",0,"Crap, Not a good game and short. Rather go OG for a game.  Waste of a PS5 title"
489,Anr0,"Nov 24, 2020",2,"Un dlc carisimo y sin acabar, lleno de errores, no pueden sacar un juego asi a la venta verguenza les deberia de dar"
490,martinho_99,"Apr 17, 2021",4,"First the positive things: Miles is a great character with lots of charm. The antagonist is also quite good. The net swinging trough new york is so ingenious, it really never gets boring. New York looks amazing, graphics are top. Fight system has fun combos.Negative points: The game is too short! You can easily finish it in under 20h maybe even under 15h. As I said the antagonist is good but this ""good person suffers from beloved ones tragic death wants revenge gets radical wants to do thing that would cost a lot of lifes but realizes at the end that it is wrong"" thing of a story has been told far too often. The side missions are not entertaining at all and just distraction. At one point even the fun fighting systems gets boring because the setting gets so repetetive - you get to a location beat up the guys beat up more guys and then do a task. Additionally there are almost no upgrades that vary or modify the fighting.The gameplay would have so much potential the graphics and the dialogues are top but 60€ for such little game is a big impudence."
491,Bonjoramigos,"Sep 23, 2021",9,"This game really grew on me. I was going in to the game thinking it was some sort of dlc. But after finishing it, it may be better (in my opinion) than the 2018 version. It is a bit shorter but the gameplay is way faster, the story is very clever and the game looks really nice. If you liked the original than you are going to like this game."
492,Mitchewix,"Apr 30, 2021",8,I absolutely loved the game aside from some political pushes. The main villain is great and the new mechanics are fun. I wish they added a bit more.
493,Ro3497,"Apr 29, 2021",8,"A more than solid game with a great ending. Fights and movement feel very smooth, especially with the new DualSense Controller."
494,Firas0002,"Nov 28, 2020",9,i didn't really like the ending otherwise everything pretty much worth it specially the quality
495,Momoki_02,"Nov 21, 2020",9,Amazing game as good as the first but the story is a bit shorter but the combat is improved.
496,XxStanTheManxX,"Jan 15, 2021",10,"Although this game is shorter in gameplay, Miles Morales is fun and beautiful! I love miles new powers. Looking forward the sequel."
497,ion87,"Sep 22, 2021",10,simply Amazing. Want to spend more time in this world. The Character are thoroughly thought out and realized. Truly felt I was spider man
498,LilTopi,"Jan  8, 2021",9,"Great game, the story is exciting. This is a short game, but don't try to prolong your experience by spreading it out. This is a game best played in one or two sittings, I played on PS5 and I'd recommend everyone wait till they get their hands on a PS5 before playing it. Overall a well packaged shorter game that's worth every dollar if you like the premise."
499,elzuri,"May 25, 2021",9,Mejor juego que el Spiderman 2018 ya que elimina todo el relleno que tenía este y se enfoca en la gran historia que tiene
500,Beaver228,"Jan  6, 2021",9,"Хорошая игра, достойное продолжение, антигерой немного разочаровал, Майлз приятный персонаж, трассировке лучей сделала невероятное ощущение и сильно добавила реализм, а ещё волосы, волосы сделали идеально!!!"
501,skeletorcares,"Feb 11, 2021",5,"It's a very pretty game has good controls, but no sustenance. If you're a fan you know most of the ""twists"" already. The gameplay is pretty derivative of the last Spiderman game. I hope the DLC brings some of the actual Spiderman villains into play. At this time, the game is just OK."
502,Awanka,"Aug  6, 2021",5,"There's nothing terribly wrong with the game other then a bit of pandering to social causes, but there's nothing particularly good either.  Gameplay is decent, but it all feels pretty repetitive if you've played the previous Ultimate Spiderman game.  Everything else is fair to bad.  A basic uninspired superhero story filled with perfunctory dialog, awful dad humor, and after-school special moralizing. A series of short and basic sidequests. A lot of these complaints could have been leveled against the first spider-man game, but it completely loses its charm the second time around.  It's a short game, and there isn't anything really next-gen about it.  It's like they just cobbled together something using the first game's engine to capitalize off of its success, and it shows."
503,fortwaynebatman,"Jul  6, 2021",8,This game really is amazing but it is just not up to the same score as the first Spider Man 2018. I like Miles but i don't love him....ya know? He has a nice story to tell and has some unique abilities but what I really love about Spider Man is his rogue gallery and Miles just doesn't have that. The short story and easy platinum is perfect for snack size gaming  though and I did enjoy my time with it. That is why it is a 8/10 from me.
504,Valkillmore,"Jun  2, 2021",7,"I feel like this game was largely overrated. Its essentially a DLC for Spider-Man (2018) with a really boring story, the gameplay additions are really fun though."
505,DARKUSER,"Oct 17, 2021",9,hshjdndbdbudbdhdidjsbgsiskabsvuwowjsbdksjhdhdidowjhehdjdndbgdjsbjskdndbdhjsnnd
506,Danielibiapina,"Jun 21, 2021",8,"Very good game,so good that deserves to be longer or a dlc later on.Fells little short."
507,Thejontxu,"May  4, 2021",0,Pero buenor k es esta mierda del spiderman negr0 k va a ser lo siguiente una spidermujer sony q te quede claro una cosa spiderman solo hay uno y ese es peter parker blanco hetero no destruyas al personaje con estas mariconadas del miles mierda morales
508,RetroGameDays36,"Sep 21, 2021",8,"There are some really great things about Miles Morales, but i think it's a bit of a downgrade compared to the original PS4 Spider-Man game, why? Well, it's because the game is short, like shorter than the original one, peter's face, i forgot they made this change but i'm still not ok with this new face, costumes are nice, but again, it's not as good as the original lineup, best one i think is The End suit, real nice insomniac really did a great job at making the world, characters, feel real There are some upgrades in it as well compared to the original, but i still prefer the original because of the story and gameplay."
509,fercho319,"Dec 31, 2020",10,"I give this game a 10/10 because lots of thinks that made the game fill special by miles and his community and family and friends. The story is short but if you also count the secoundary missions the game approximately is about 30,40 hours so it is long enough.The city is the same but it fills different because is snowy, the graphics are 10 the animations of miles by swinging are absolutely awesome. I really recomend this game."
510,mertbcansel,"May  5, 2021",10,"10/10 Standalone game. Insomniac Games really know how to deal with Spiderman games. Combats,, story, music and graphics are awesome. Play that game on Performance RT mode. It provides 60 FPS with Ray Tracing. Plus Spiderman Miles Morales has the best credit scene."
511,propulsion,"Mar  7, 2021",8,"This was a tough game to rate. I think it’s probably an 8.5. To sum it up quick, game wise it is a lot like Spider-Man Remastered on PS5, except shorter. I thought the Spider-Man Remastered (and PS4 version) was amazing...a 9.5 out of 10 for me, a fantastic super hero game, with my favorite super hero as a kid. Besides this game being short, I admit Miles was tough for me to accept at first, when he got spider powers that is. Two Spider-Mans?  That was really dumb to me, just like two Batmans or two Supermans would be.  And I did not like into the spider verse.  Eventually  Miles grew on me in this game, even though he is too much like Peter.  Also there are some politics in this game, which I am tempted to knock another number off for.Bottom line if you crave more of the last game, this one might scratch that itch, cons aside."
512,FRIST_008,"Jun 14, 2021",9,"Самая правильная игра про супергероя, в которую я играл. Такого разнообразия сюжета и механик надо ещё поискать у соперников подобного жанра"
513,1Filip98,"Dec  8, 2020",7,"Game is incredibly short, felt more like a 20$ DLC. City was basically a copy paste with some new locations, but somehow they managed to make more bugs. New Peter is hit or miss, to me he looks like 16 yo teenager, not like 25 year old grown man. who's doing this for +- 8 years. Regarding actor performance, Mile's was pretty good, not like Peter in the OG game, but not bad at all.  No really fun side quests or side missions. Less gadgets in first game, while venom powers were super OP, the game was basically easy mode even on hardest. Story wasn't interesting, some good ""boss"" fights, but nothing that great. The main villain, meh... The characters were sometimes sooo stupid, just to allow the plot to move forward. Like the main female villain of the game. I'd recommend this game only if on sale. Not worth it for the full price."
514,Ducroste,"Nov 19, 2020",6,"It is a game that will never bore you but it should be longer, it only lasted 5.8 hours, and also that there are bugs that can damage your game, the game is good but that must be the ""problem"""
515,Basehype9,"Dec 15, 2020",7,"Superb graphics, throughout the game I often found myself staring at gorgeous textures and environment specially the indoor parts of the game. Lets look at one of the s4's lunch titles namely killzone shadow fall. we can see hoe that game looks now and how outdated the graphics of that game look now. wow just wow we are starting this generation with such graphic quality, I can't even imagine what naughty dog and other studios will accomplish with ps5 at the end of the generation. on the other hand other aspects of the game like story and gameplay look and feel exactly like the first spider-man and to be honest at points it got super boring. felt in regards to gameplay there wasn't much improvement from its predecessor. moreover the story mode is super short and if you collect everything it might take around 10 hours or a little bit more. the story on the highest difficulty took  me about 4 hours to finish."
516,amin1,"Feb 10, 2021",10,"کسانی که به این بازی نمرات زیر 5 میدن , یا از هواداران ماکروسافت واسه خالی کردن عقده هاشون یا این ک واقعا کصخلن و حسابی دوست دارن کرم بریزن"
517,ElDavid,"Feb  1, 2021",4,"Well, this sucked, speccialy for the price i payed.The story is awful, like almost laughable. The gameplay is identical altough somehow worse than the original. And the world is almost the same. And this is what, 50 dollars? For this?"
518,Iserra94,"Apr 15, 2021",2,Fabularnie gra fajnie lecz strasznie niedopracowane i posiadająca masę błędòw jak blokowanie się bohatera w niektórych misjach przez niewidzialne ściany lub śmierć spowodowana tramwajem w Harlem spowodowała czarny ekran bez możliwości zrobienia jakiejkolwiek akcji. Po zrestartowaniu gry pojawił się problem związany z wystąpieniem błędu w aplikacji który po odczekaniu około 30 min nic nie ukazywał i zmusił do zrobienia restartu konsoli. Po restarcie utracone zostały wszystkie postępy do ostatniej misji fabularnej..... Ocena 2 z powodu licznych błędów pulsujących grę i odczucia z niej które w pierwszej kolejności wskazywały na fajnie ulepszony gameplay z podstawowego spider mana
519,clanky9,"Dec 28, 2020",9,"I personally enjoyed this game, gameplay and graphics are amazing, story is great (9/10) only one problem with this game is thats is really short ive completed it in 3 days."
520,Raios-Rogue,"Jun 16, 2021",10,short and sweet game great original story emotional ending great music fantastic gameplay the best graphics this game blows away any PC game when it comes to graphics Insomniac keep updating their game and give love to the fans and the venom bio electric energy made the combat mechanics so much better than the first game with the left and right arrowkey shortcuts where a nice touch top notch motion per object motiom blur makes the fidelity native 4k 30fps mode feel like 60fps the RT performance mode is fantastic as well one of the best way to play the game for sure the game has just a few minor bugs where somehow i went true the wall of a building  while crawling and i got stuck and a few crashes suits could have used awesome abilities like in the first game the muscle deformation Ziva RT filmic quality with hardware machine learning suit they added was awesome best spiderman game up to date it easily entered in my top 20 list of best games of century and became one of my favorite games of all time which i platinumed
521,Cwouda,"May 19, 2021",10,This game is amazing great gameplay and graphics very good story. There is really no negatives to it a must play if you own a PlayStation
522,SeaSphynx,"May  1, 2021",6,Did not live up to the hype for me. It felt like a generic and cheap story put together just so people don't question Miles being a major part of Spiderman 2 PS5. I love the first game's sense of real struggle that Peter had to go through. And I get Miles OBVIOUSLY goes through some hardship through this one too but it just DOESN'T have the same sense of quality that Spiderman PS4 had. Quickly put together and WAAAAAAAY too short for $50. Also some really crappy acting in some spots with some extremely generic characters like one of the main villains (Krieger). I just hoper Insomniac learns that they shouldn't make a short generic game like this again for the same price as this was.
523,SilentChief,"Mar  4, 2021",9,"A truly technical miracle, quality ray-tracing reflections everywhe @ 60 fps. Overhauled combat system is amazing and it probably has the funniest traversal ever. The only downside is its length, but understandable for a launch game. Go play it! :)"
524,Youngish2k51,"Dec 21, 2020",8,"Miles Morales take the regular game and doesn't do much with it. The game is as fluid, slick, and fun as ever and Mile's has his own unique personality instead of just being a peter Parker clone,you can tell he's trying his best to get used to being his own spider-man and that he's still youbg and has along way to go to becoming a professional, while the graphics are great at times they diminish and I really wish we had a mode where we had 60 fps and 4k instead of having to pick between 30 4k and 60 1400, hopefully they make it this way one day, my other complaints are that other than Miles, no one else is really interesting and the characters are just there kinda just being a clique, also I personally didn't really find the story to be all that interesting, Mile's development is what really carried the story and I really wished the game would have tried adding new stuff instead of just some skins and a new move, overall if you own a ps5 I recommend getting this game but don't buy this one, I recommend buying the ultimate edition as it's only $20 more expensive but it comes with a remastered version of the regular game so you're basically saving money."
525,Ight,"Nov 18, 2020",7,"The game is a mixture for me, on one hand it looks gorgeous, and the combat has been refined. On the other hand I wish this game had a 1080p 60 fps raytracing mode since when switching between both modes in the game it felt like i got a major drawback either way. Can't say much about the story, I beat it in 5 hours and I paid 50 bucks for this, i'd wait till it drops to 40-30 dollar range. Side missions felt mostly generic but a little more personal for some of them. I'm rating this a 7/10 for the lack of length considering I beat this in a day, and this game is 10 dollars cheaper than the first game but is nowhere near the time I spent on the previous game"
526,Bike_3809,"Feb  1, 2021",0,"Игра интересна на 20% потом начинается унылое собирательство и пара доп миссий. Можно пройти за один вечер или за пару вечеров на все награды. Напрягает политика в игре особенно когда тебя к ней выводят и показывают что правильно, зачем я пришел отдохнуть посмотреть на хорошую игру а не сраную политику и особенно про какое то там движение. Так что не советую"
527,koenhamboy,"May 11, 2021",8,"Great but not amazing, Fun game but didn't excite me after the first game. When I first played Miles Morales I thought it was incredible and I got the platinum trophy in one weekend. But recently I've played through the first game and Miles just doesn't step even close to it. Miles Morales is an amazing experience but it is outshined by the previous game. Obviously the swinging and the graphics are far better but the story of Spider-Man ps4 is untouchable. And that's okay, Miles Morales was never trying to be better than peter the game wasn't supposed to be a sequel, Its a spin off. We can't expect a big world breaking event from miles' first year (and first week) solo spider-manning. Great game though would recommend"
